Sheet: Sheet1
A1: ID | B1: IDVUNGTRONG | C1: IDNHATKY (ID của B.3) | D1: TENNHATKY | E1: CACHSUDUNG | F1: NGAYTHUCHIEN | G1: SAPXEP | H1: GHICHU
A2: 1 | B2: 1 | C2: 1 | D2: + Tên giống: | E2: OM5451. | F2: 2022-09-17T00:00:00.000 | G2: 1
A3: 2 | B3: 1 | C3: 1 | D3: + Xử lý hạt giống: | E3: Ngâm axít. | F3: 2022-09-17T00:00:00.000 | G3: 2
A4: 3 | B4: 1 | C4: 2 | D4: + Làm đất (cày xới bừa trục), độ xâu lớp cày: | E4: 15 cm | F4: 2022-08-25T00:00:00.000 | G4: 1
A5: 4 | B5: 1 | C5: 2 | D5: + San sửa mặt bằng đồng ruộng | F5: 2022-08-25T00:00:00.000 | G5: 2
A6: 5 | B6: 1 | C6: 2 | D6: + Đánh rãnh nước gieo sạ | F6: 2022-08-25T00:00:00.000 | G6: 3
A7: 6 | B7: 1 | C7: 3 | D7: + Nguồn nước tưới: | E7: Nhiễm mặn | F7: 2022-10-09T00:00:00.000 | G7: 1
A8: 7 | B8: 1 | C8: 3 | D8: + Chủ động tưới tiêu | F8: 2022-10-09T00:00:00.000 | G8: 2
A9: 8 | B9: 1 | C9: 3 | D9: + Ứng dụng bơm nước tập trung | F9: 2022-10-09T00:00:00.000 | G9: 3
A10: 9 | B10: 1 | C10: 5 | D10: + Phun thuốc định kỳ | F10: 2022-10-26T00:00:00.000
A11: 10 | B11: 2 | C11: 6 | D11: + Tên giống: | E11: OM5451. | F11: 2022-09-17T00:00:00.000 | G11: 1
A12: 11 | B12: 2 | C12: 6 | D12: + Xử lý hạt giống: | E12: Ngâm axít. | F12: 2022-09-17T00:00:00.000 | G12: 2
A13: 12 | B13: 2 | C13: 7 | D13: + Làm đất (cày xới bừa trục), độ xâu lớp cày: | E13: 15 cm | F13: 2022-08-25T00:00:00.000 | G13: 1
A14: 13 | B14: 2 | C14: 7 | D14: + San sửa mặt bằng đồng ruộng | F14: 2022-08-25T00:00:00.000 | G14: 2
A15: 14 | B15: 2 | C15: 7 | D15: + Đánh rãnh nước gieo sạ | F15: 2022-08-25T00:00:00.000 | G15: 3
A16: 15 | B16: 2 | C16: 8 | D16: + Nguồn nước tưới: | E16: Nhiễm mặn | F16: 2022-10-09T00:00:00.000 | G16: 1
A17: 16 | B17: 2 | C17: 8 | D17: + Chủ động tưới tiêu | F17: 2022-10-09T00:00:00.000 | G17: 2
A18: 17 | B18: 2 | C18: 8 | D18: + Ứng dụng bơm nước tập trung | F18: 2022-10-09T00:00:00.000 | G18: 3
A19: 18 | B19: 2 | C19: 10 | D19: + Phun thuốc định kỳ | F19: 2022-10-26T00:00:00.000
A20: 19 | B20: =R[-9]C+1 -> 3 | C20: 11 | D20: + Tên giống: | E20: OM5451. | F20: 2022-09-17T00:00:00.000 | G20: 1
A21: 20 | B21: =R[-9]C+1 -> 3 | C21: 11 | D21: + Xử lý hạt giống: | E21: Ngâm axít. | F21: 2022-09-17T00:00:00.000 | G21: 2
A22: 21 | B22: =R[-9]C+1 -> 3 | C22: 12 | D22: + Làm đất (cày xới bừa trục), độ xâu lớp cày: | E22: 15 cm | F22: 2022-08-25T00:00:00.000 | G22: 1
A23: 22 | B23: =R[-9]C+1 -> 3 | C23: 12 | D23: + San sửa mặt bằng đồng ruộng | F23: 2022-08-25T00:00:00.000 | G23: 2
A24: 23 | B24: =R[-9]C+1 -> 3 | C24: 12 | D24: + Đánh rãnh nước gieo sạ | F24: 2022-08-25T00:00:00.000 | G24: 3
A25: 24 | B25: =R[-9]C+1 -> 3 | C25: 13 | D25: + Nguồn nước tưới: | E25: Nhiễm mặn | F25: 2022-10-09T00:00:00.000 | G25: 1
A26: 25 | B26: =R[-9]C+1 -> 3 | C26: 13 | D26: + Chủ động tưới tiêu | F26: 2022-10-09T00:00:00.000 | G26: 2
A27: 26 | B27: =R[-9]C+1 -> 3 | C27: 13 | D27: + Ứng dụng bơm nước tập trung | F27: 2022-10-09T00:00:00.000 | G27: 3
A28: 27 | B28: =R[-9]C+1 -> 3 | C28: 15 | D28: + Phun thuốc định kỳ | F28: 2022-10-26T00:00:00.000
A29: 28
A30: 29
A31: 30
A32: 31
A33: 32
A34: 33
A35: 34
A36: 35
A37: 36
A38: 37
A39: 38
A40: 39
A41: 40
A42: 41
A43: 42
A44: 43
A45: 44
A46: 45
A47: 46
A48: 47
A49: 48
A50: 49
A51: 50
A52: 51
A53: 52
A54: 53
A55: 54
A56: 55
A57: 56
A58: 57
A59: 58
A60: 59
A61: 60
A62: 61
A63: 62
A64: 63
A65: 64
A66: 65
A67: 66
A68: 67
A69: 68
A70: 69
A71: 70
A72: 71
A73: 72
A74: 73
A75: 74
A76: 75
A77: 76
A78: 77
A79: 78
A80: 79
A81: 80
A82: 81
A83: 82
A84: 83
A85: 84
A86: 85
A87: 86
A88: 87
A89: 88
A90: 89
A91: 90
A92: 91
A93: 92
A94: 93
A95: 94
A96: 95
A97: 96
A98: 97
A99: 98
A100: 99