Sheet: Sheet1
A1: ID | B1: IDVUNGTRONG | C1: IDNHATKY (cố định) | D1: SUDUNGTHUOC | E1: NGAYTHUCHIEN | F1: SAPXEP | G1: GHICHU
A2: 1 | B2: 1 | C2: 5 | D2: + Thuốc trừ ốc: | E2: 2022-10-26 | F2: 1
A3: 2 | B3: 1 | C3: 5 | D3: + Thuốc trừ cỏ: | E3: 2022-10-26 | F3: 2
A4: 3 | B4: 1 | C4: 5 | D4: + Thuốc trừ bệnh: | E4: 2022-10-26 | F4: 3
A5: 4 | B5: 1 | C5: 5 | D5: + Phối hợp thuốc (trừ sâu - bệnh): | E5: 2022-10-26 | F5: 4
A6: 5 | B6: 1 | C6: 5 | D6: + Phối hợp thuốc (trừ rầy - bệnh): | E6: 2022-10-26 | F6: 5
A7: 6 | B7: 1 | C7: 5 | D7: + Phun theo thời điểm: | E7: 2022-10-26 | F7: 6
A8: 7 | B8: 2 | C8: 5 | D8: + Thuốc trừ ốc: | E8: 2022-10-26 | F8: 1
A9: 8 | B9: 2 | C9: 5 | D9: + Thuốc trừ cỏ: | E9: 2022-10-26 | F9: 2
A10: 9 | B10: 2 | C10: 5 | D10: + Thuốc trừ bệnh: | E10: 2022-10-26 | F10: 3
A11: 10 | B11: 2 | C11: 5 | D11: + Phối hợp thuốc (trừ sâu - bệnh): | E11: 2022-10-26 | F11: 4
A12: 11 | B12: 2 | C12: 5 | D12: + Phối hợp thuốc (trừ rầy - bệnh): | E12: 2022-10-26 | F12: 5
A13: 12 | B13: 2 | C13: 5 | D13: + Phun theo thời điểm: | E13: 2022-10-26 | F13: 6
A14: 13 | B14: 3 | C14: 5 | D14: + Thuốc trừ ốc: | E14: 2022-10-26 | F14: 1
A15: 14 | B15: 3 | C15: 5 | D15: + Thuốc trừ cỏ: | E15: 2022-10-26 | F15: 2
A16: 15 | B16: 3 | C16: 5 | D16: + Thuốc trừ bệnh: | E16: 2022-10-26 | F16: 3
A17: 16 | B17: 3 | C17: 5 | D17: + Phối hợp thuốc (trừ sâu - bệnh): | E17: 2022-10-26 | F17: 4
A18: 17 | B18: 3 | C18: 5 | D18: + Phối hợp thuốc (trừ rầy - bệnh): | E18: 2022-10-26 | F18: 5
A19: 18 | B19: 3 | C19: 5 | D19: + Phun theo thời điểm: | E19: 2022-10-26 | F19: 6
A20: 19 | B20: =R[-6]C+1 -> 4 | C20: 5 | D20: + Thuốc trừ ốc: | E20: 2022-10-26 | F20: 1
A21: 20 | B21: =R[-6]C+1 -> 4 | C21: 5 | D21: + Thuốc trừ cỏ: | E21: 2022-10-26 | F21: 2
A22: 21 | B22: =R[-6]C+1 -> 4 | C22: 5 | D22: + Thuốc trừ bệnh: | E22: 2022-10-26 | F22: 3
A23: 22 | B23: =R[-6]C+1 -> 4 | C23: 5 | D23: + Phối hợp thuốc (trừ sâu - bệnh): | E23: 2022-10-26 | F23: 4
A24: 23 | B24: =R[-6]C+1 -> 4 | C24: 5 | D24: + Phối hợp thuốc (trừ rầy - bệnh): | E24: 2022-10-26 | F24: 5
A25: 24 | B25: =R[-6]C+1 -> 4 | C25: 5 | D25: + Phun theo thời điểm: | E25: 2022-10-26 | F25: 6
A26: 25 | B26: =R[-6]C+1 -> 5 | C26: 5 | D26: + Thuốc trừ ốc: | E26: 2022-10-26 | F26: 1
A27: 26 | B27: =R[-6]C+1 -> 5 | C27: 5 | D27: + Thuốc trừ cỏ: | E27: 2022-10-26 | F27: 2
A28: 27 | B28: =R[-6]C+1 -> 5 | C28: 5 | D28: + Thuốc trừ bệnh: | E28: 2022-10-26 | F28: 3
A29: 28 | B29: =R[-6]C+1 -> 5 | C29: 5 | D29: + Phối hợp thuốc (trừ sâu - bệnh): | E29: 2022-10-26 | F29: 4
A30: 29 | B30: =R[-6]C+1 -> 5 | C30: 5 | D30: + Phối hợp thuốc (trừ rầy - bệnh): | E30: 2022-10-26 | F30: 5
A31: 30 | B31: =R[-6]C+1 -> 5 | C31: 5 | D31: + Phun theo thời điểm: | E31: 2022-10-26 | F31: 6
A32: 31 | B32: =R[-6]C+1 -> 6 | C32: 5 | D32: + Thuốc trừ ốc: | E32: 2022-10-26 | F32: 1
A33: 32 | B33: =R[-6]C+1 -> 6 | C33: 5 | D33: + Thuốc trừ cỏ: | E33: 2022-10-26 | F33: 2
A34: 33 | B34: =R[-6]C+1 -> 6 | C34: 5 | D34: + Thuốc trừ bệnh: | E34: 2022-10-26 | F34: 3
A35: 34 | B35: =R[-6]C+1 -> 6 | C35: 5 | D35: + Phối hợp thuốc (trừ sâu - bệnh): | E35: 2022-10-26 | F35: 4
A36: 35 | B36: =R[-6]C+1 -> 6 | C36: 5 | D36: + Phối hợp thuốc (trừ rầy - bệnh): | E36: 2022-10-26 | F36: 5
A37: 36 | B37: =R[-6]C+1 -> 6 | C37: 5 | D37: + Phun theo thời điểm: | E37: 2022-10-26 | F37: 6
A38: 37 | B38: =R[-6]C+1 -> 7 | C38: 5 | D38: + Thuốc trừ ốc: | E38: 2022-10-26 | F38: 1
A39: 38 | B39: =R[-6]C+1 -> 7 | C39: 5 | D39: + Thuốc trừ cỏ: | E39: 2022-10-26 | F39: 2
A40: 39 | B40: =R[-6]C+1 -> 7 | C40: 5 | D40: + Thuốc trừ bệnh: | E40: 2022-10-26 | F40: 3
A41: 40 | B41: =R[-6]C+1 -> 7 | C41: 5 | D41: + Phối hợp thuốc (trừ sâu - bệnh): | E41: 2022-10-26 | F41: 4
A42: 41 | B42: =R[-6]C+1 -> 7 | C42: 5 | D42: + Phối hợp thuốc (trừ rầy - bệnh): | E42: 2022-10-26 | F42: 5
A43: 42 | B43: =R[-6]C+1 -> 7 | C43: 5 | D43: + Phun theo thời điểm: | E43: 2022-10-26 | F43: 6
A44: 43 | B44: =R[-6]C+1 -> 8 | C44: 5 | D44: + Thuốc trừ ốc: | E44: 2022-10-26 | F44: 1
A45: 44 | B45: =R[-6]C+1 -> 8 | C45: 5 | D45: + Thuốc trừ cỏ: | E45: 2022-10-26 | F45: 2
A46: 45 | B46: =R[-6]C+1 -> 8 | C46: 5 | D46: + Thuốc trừ bệnh: | E46: 2022-10-26 | F46: 3
A47: 46 | B47: =R[-6]C+1 -> 8 | C47: 5 | D47: + Phối hợp thuốc (trừ sâu - bệnh): | E47: 2022-10-26 | F47: 4
A48: 47 | B48: =R[-6]C+1 -> 8 | C48: 5 | D48: + Phối hợp thuốc (trừ rầy - bệnh): | E48: 2022-10-26 | F48: 5
A49: 48 | B49: =R[-6]C+1 -> 8 | C49: 5 | D49: + Phun theo thời điểm: | E49: 2022-10-26 | F49: 6
A50: 49 | B50: =R[-6]C+1 -> 9 | C50: 5 | D50: + Thuốc trừ ốc: | E50: 2022-10-26 | F50: 1
A51: 50 | B51: =R[-6]C+1 -> 9 | C51: 5 | D51: + Thuốc trừ cỏ: | E51: 2022-10-26 | F51: 2
A52: 51 | B52: =R[-6]C+1 -> 9 | C52: 5 | D52: + Thuốc trừ bệnh: | E52: 2022-10-26 | F52: 3
A53: 52 | B53: =R[-6]C+1 -> 9 | C53: 5 | D53: + Phối hợp thuốc (trừ sâu - bệnh): | E53: 2022-10-26 | F53: 4
A54: 53 | B54: =R[-6]C+1 -> 9 | C54: 5 | D54: + Phối hợp thuốc (trừ rầy - bệnh): | E54: 2022-10-26 | F54: 5
A55: 54 | B55: =R[-6]C+1 -> 9 | C55: 5 | D55: + Phun theo thời điểm: | E55: 2022-10-26 | F55: 6
A56: 55 | B56: =R[-6]C+1 -> 10 | C56: 5 | D56: + Thuốc trừ ốc: | E56: 2022-10-26 | F56: 1
A57: 56 | B57: =R[-6]C+1 -> 10 | C57: 5 | D57: + Thuốc trừ cỏ: | E57: 2022-10-26 | F57: 2
A58: 57 | B58: =R[-6]C+1 -> 10 | C58: 5 | D58: + Thuốc trừ bệnh: | E58: 2022-10-26 | F58: 3
A59: 58 | B59: =R[-6]C+1 -> 10 | C59: 5 | D59: + Phối hợp thuốc (trừ sâu - bệnh): | E59: 2022-10-26 | F59: 4
A60: 59 | B60: =R[-6]C+1 -> 10 | C60: 5 | D60: + Phối hợp thuốc (trừ rầy - bệnh): | E60: 2022-10-26 | F60: 5
A61: 60 | B61: =R[-6]C+1 -> 10 | C61: 5 | D61: + Phun theo thời điểm: | E61: 2022-10-26 | F61: 6
A62: 61 | B62: =R[-6]C+1 -> 11 | C62: 5 | D62: + Thuốc trừ ốc: | E62: 2022-10-26 | F62: 1
A63: 62 | B63: =R[-6]C+1 -> 11 | C63: 5 | D63: + Thuốc trừ cỏ: | E63: 2022-10-26 | F63: 2
A64: 63 | B64: =R[-6]C+1 -> 11 | C64: 5 | D64: + Thuốc trừ bệnh: | E64: 2022-10-26 | F64: 3
A65: 64 | B65: =R[-6]C+1 -> 11 | C65: 5 | D65: + Phối hợp thuốc (trừ sâu - bệnh): | E65: 2022-10-26 | F65: 4
A66: 65 | B66: =R[-6]C+1 -> 11 | C66: 5 | D66: + Phối hợp thuốc (trừ rầy - bệnh): | E66: 2022-10-26 | F66: 5
A67: 66 | B67: =R[-6]C+1 -> 11 | C67: 5 | D67: + Phun theo thời điểm: | E67: 2022-10-26 | F67: 6
A68: 67 | B68: =R[-6]C+1 -> 12 | C68: 5 | D68: + Thuốc trừ ốc: | E68: 2022-10-26 | F68: 1
A69: 68 | B69: =R[-6]C+1 -> 12 | C69: 5 | D69: + Thuốc trừ cỏ: | E69: 2022-10-26 | F69: 2
A70: 69 | B70: =R[-6]C+1 -> 12 | C70: 5 | D70: + Thuốc trừ bệnh: | E70: 2022-10-26 | F70: 3
A71: 70 | B71: =R[-6]C+1 -> 12 | C71: 5 | D71: + Phối hợp thuốc (trừ sâu - bệnh): | E71: 2022-10-26 | F71: 4
A72: 71 | B72: =R[-6]C+1 -> 12 | C72: 5 | D72: + Phối hợp thuốc (trừ rầy - bệnh): | E72: 2022-10-26 | F72: 5
A73: 72 | B73: =R[-6]C+1 -> 12 | C73: 5 | D73: + Phun theo thời điểm: | E73: 2022-10-26 | F73: 6
A74: 73 | B74: =R[-6]C+1 -> 13 | C74: 5 | D74: + Thuốc trừ ốc: | E74: 2022-10-26 | F74: 1
A75: 74 | B75: =R[-6]C+1 -> 13 | C75: 5 | D75: + Thuốc trừ cỏ: | E75: 2022-10-26 | F75: 2
A76: 75 | B76: =R[-6]C+1 -> 13 | C76: 5 | D76: + Thuốc trừ bệnh: | E76: 2022-10-26 | F76: 3
A77: 76 | B77: =R[-6]C+1 -> 13 | C77: 5 | D77: + Phối hợp thuốc (trừ sâu - bệnh): | E77: 2022-10-26 | F77: 4
A78: 77 | B78: =R[-6]C+1 -> 13 | C78: 5 | D78: + Phối hợp thuốc (trừ rầy - bệnh): | E78: 2022-10-26 | F78: 5
A79: 78 | B79: =R[-6]C+1 -> 13 | C79: 5 | D79: + Phun theo thời điểm: | E79: 2022-10-26 | F79: 6
A80: 79 | B80: =R[-6]C+1 -> 14 | C80: 5 | D80: + Thuốc trừ ốc: | E80: 2022-10-26 | F80: 1
A81: 80 | B81: =R[-6]C+1 -> 14 | C81: 5 | D81: + Thuốc trừ cỏ: | E81: 2022-10-26 | F81: 2
A82: 81 | B82: =R[-6]C+1 -> 14 | C82: 5 | D82: + Thuốc trừ bệnh: | E82: 2022-10-26 | F82: 3
A83: 82 | B83: =R[-6]C+1 -> 14 | C83: 5 | D83: + Phối hợp thuốc (trừ sâu - bệnh): | E83: 2022-10-26 | F83: 4
A84: 83 | B84: =R[-6]C+1 -> 14 | C84: 5 | D84: + Phối hợp thuốc (trừ rầy - bệnh): | E84: 2022-10-26 | F84: 5
A85: 84 | B85: =R[-6]C+1 -> 14 | C85: 5 | D85: + Phun theo thời điểm: | E85: 2022-10-26 | F85: 6
A86: 85 | B86: =R[-6]C+1 -> 15 | C86: 5 | D86: + Thuốc trừ ốc: | E86: 2022-10-26 | F86: 1
A87: 86 | B87: =R[-6]C+1 -> 15 | C87: 5 | D87: + Thuốc trừ cỏ: | E87: 2022-10-26 | F87: 2
A88: 87 | B88: =R[-6]C+1 -> 15 | C88: 5 | D88: + Thuốc trừ bệnh: | E88: 2022-10-26 | F88: 3
A89: 88 | B89: =R[-6]C+1 -> 15 | C89: 5 | D89: + Phối hợp thuốc (trừ sâu - bệnh): | E89: 2022-10-26 | F89: 4
A90: 89 | B90: =R[-6]C+1 -> 15 | C90: 5 | D90: + Phối hợp thuốc (trừ rầy - bệnh): | E90: 2022-10-26 | F90: 5
A91: 90 | B91: =R[-6]C+1 -> 15 | C91: 5 | D91: + Phun theo thời điểm: | E91: 2022-10-26 | F91: 6
A92: 91 | B92: =R[-6]C+1 -> 16 | C92: 5 | D92: + Thuốc trừ ốc: | E92: 2022-10-26 | F92: 1
A93: 92 | B93: =R[-6]C+1 -> 16 | C93: 5 | D93: + Thuốc trừ cỏ: | E93: 2022-10-26 | F93: 2
A94: 93 | B94: =R[-6]C+1 -> 16 | C94: 5 | D94: + Thuốc trừ bệnh: | E94: 2022-10-26 | F94: 3
A95: 94 | B95: =R[-6]C+1 -> 16 | C95: 5 | D95: + Phối hợp thuốc (trừ sâu - bệnh): | E95: 2022-10-26 | F95: 4
A96: 95 | B96: =R[-6]C+1 -> 16 | C96: 5 | D96: + Phối hợp thuốc (trừ rầy - bệnh): | E96: 2022-10-26 | F96: 5
A97: 96 | B97: =R[-6]C+1 -> 16 | C97: 5 | D97: + Phun theo thời điểm: | E97: 2022-10-26 | F97: 6
A98: 97 | B98: =R[-6]C+1 -> 17 | C98: 5 | D98: + Thuốc trừ ốc: | E98: 2022-10-26 | F98: 1
A99: 98 | B99: =R[-6]C+1 -> 17 | C99: 5 | D99: + Thuốc trừ cỏ: | E99: 2022-10-26 | F99: 2
A100: 99 | B100: =R[-6]C+1 -> 17 | C100: 5 | D100: + Thuốc trừ bệnh: | E100: 2022-10-26 | F100: 3
A101: 100 | B101: =R[-6]C+1 -> 17 | C101: 5 | D101: + Phối hợp thuốc (trừ sâu - bệnh): | E101: 2022-10-26 | F101: 4
A102: 101 | B102: =R[-6]C+1 -> 17 | C102: 5 | D102: + Phối hợp thuốc (trừ rầy - bệnh): | E102: 2022-10-26 | F102: 5
A103: 102 | B103: =R[-6]C+1 -> 17 | C103: 5 | D103: + Phun theo thời điểm: | E103: 2022-10-26 | F103: 6
A104: 103 | B104: =R[-6]C+1 -> 18 | C104: 5 | D104: + Thuốc trừ ốc: | E104: 2022-10-26 | F104: 1
A105: 104 | B105: =R[-6]C+1 -> 18 | C105: 5 | D105: + Thuốc trừ cỏ: | E105: 2022-10-26 | F105: 2
A106: 105 | B106: =R[-6]C+1 -> 18 | C106: 5 | D106: + Thuốc trừ bệnh: | E106: 2022-10-26 | F106: 3
A107: 106 | B107: =R[-6]C+1 -> 18 | C107: 5 | D107: + Phối hợp thuốc (trừ sâu - bệnh): | E107: 2022-10-26 | F107: 4
A108: 107 | B108: =R[-6]C+1 -> 18 | C108: 5 | D108: + Phối hợp thuốc (trừ rầy - bệnh): | E108: 2022-10-26 | F108: 5
A109: 108 | B109: =R[-6]C+1 -> 18 | C109: 5 | D109: + Phun theo thời điểm: | E109: 2022-10-26 | F109: 6
A110: 109 | B110: =R[-6]C+1 -> 19 | C110: 5 | D110: + Thuốc trừ ốc: | E110: 2022-10-26 | F110: 1
A111: 110 | B111: =R[-6]C+1 -> 19 | C111: 5 | D111: + Thuốc trừ cỏ: | E111: 2022-10-26 | F111: 2
A112: 111 | B112: =R[-6]C+1 -> 19 | C112: 5 | D112: + Thuốc trừ bệnh: | E112: 2022-10-26 | F112: 3
A113: 112 | B113: =R[-6]C+1 -> 19 | C113: 5 | D113: + Phối hợp thuốc (trừ sâu - bệnh): | E113: 2022-10-26 | F113: 4
A114: 113 | B114: =R[-6]C+1 -> 19 | C114: 5 | D114: + Phối hợp thuốc (trừ rầy - bệnh): | E114: 2022-10-26 | F114: 5
A115: 114 | B115: =R[-6]C+1 -> 19 | C115: 5 | D115: + Phun theo thời điểm: | E115: 2022-10-26 | F115: 6
A116: 115 | B116: =R[-6]C+1 -> 20 | C116: 5 | D116: + Thuốc trừ ốc: | E116: 2022-10-26 | F116: 1
A117: 116 | B117: =R[-6]C+1 -> 20 | C117: 5 | D117: + Thuốc trừ cỏ: | E117: 2022-10-26 | F117: 2
A118: 117 | B118: =R[-6]C+1 -> 20 | C118: 5 | D118: + Thuốc trừ bệnh: | E118: 2022-10-26 | F118: 3
A119: 118 | B119: =R[-6]C+1 -> 20 | C119: 5 | D119: + Phối hợp thuốc (trừ sâu - bệnh): | E119: 2022-10-26 | F119: 4
A120: 119 | B120: =R[-6]C+1 -> 20 | C120: 5 | D120: + Phối hợp thuốc (trừ rầy - bệnh): | E120: 2022-10-26 | F120: 5
A121: 120 | B121: =R[-6]C+1 -> 20 | C121: 5 | D121: + Phun theo thời điểm: | E121: 2022-10-26 | F121: 6
A122: 121 | B122: =R[-6]C+1 -> 21 | C122: 5 | D122: + Thuốc trừ ốc: | E122: 2022-10-26 | F122: 1
A123: 122 | B123: =R[-6]C+1 -> 21 | C123: 5 | D123: + Thuốc trừ cỏ: | E123: 2022-10-26 | F123: 2
A124: 123 | B124: =R[-6]C+1 -> 21 | C124: 5 | D124: + Thuốc trừ bệnh: | E124: 2022-10-26 | F124: 3
A125: 124 | B125: =R[-6]C+1 -> 21 | C125: 5 | D125: + Phối hợp thuốc (trừ sâu - bệnh): | E125: 2022-10-26 | F125: 4
A126: 125 | B126: =R[-6]C+1 -> 21 | C126: 5 | D126: + Phối hợp thuốc (trừ rầy - bệnh): | E126: 2022-10-26 | F126: 5
A127: 126 | B127: =R[-6]C+1 -> 21 | C127: 5 | D127: + Phun theo thời điểm: | E127: 2022-10-26 | F127: 6
A128: 127 | B128: =R[-6]C+1 -> 22 | C128: 5 | D128: + Thuốc trừ ốc: | E128: 2022-10-26 | F128: 1
A129: 128 | B129: =R[-6]C+1 -> 22 | C129: 5 | D129: + Thuốc trừ cỏ: | E129: 2022-10-26 | F129: 2
A130: 129 | B130: =R[-6]C+1 -> 22 | C130: 5 | D130: + Thuốc trừ bệnh: | E130: 2022-10-26 | F130: 3
A131: 130 | B131: =R[-6]C+1 -> 22 | C131: 5 | D131: + Phối hợp thuốc (trừ sâu - bệnh): | E131: 2022-10-26 | F131: 4
A132: 131 | B132: =R[-6]C+1 -> 22 | C132: 5 | D132: + Phối hợp thuốc (trừ rầy - bệnh): | E132: 2022-10-26 | F132: 5
A133: 132 | B133: =R[-6]C+1 -> 22 | C133: 5 | D133: + Phun theo thời điểm: | E133: 2022-10-26 | F133: 6
A134: 133 | B134: =R[-6]C+1 -> 23 | C134: 5 | D134: + Thuốc trừ ốc: | E134: 2022-10-26 | F134: 1
A135: 134 | B135: =R[-6]C+1 -> 23 | C135: 5 | D135: + Thuốc trừ cỏ: | E135: 2022-10-26 | F135: 2
A136: 135 | B136: =R[-6]C+1 -> 23 | C136: 5 | D136: + Thuốc trừ bệnh: | E136: 2022-10-26 | F136: 3
A137: 136 | B137: =R[-6]C+1 -> 23 | C137: 5 | D137: + Phối hợp thuốc (trừ sâu - bệnh): | E137: 2022-10-26 | F137: 4
A138: 137 | B138: =R[-6]C+1 -> 23 | C138: 5 | D138: + Phối hợp thuốc (trừ rầy - bệnh): | E138: 2022-10-26 | F138: 5
A139: 138 | B139: =R[-6]C+1 -> 23 | C139: 5 | D139: + Phun theo thời điểm: | E139: 2022-10-26 | F139: 6
A140: 139 | B140: =R[-6]C+1 -> 24 | C140: 5 | D140: + Thuốc trừ ốc: | E140: 2022-10-26 | F140: 1
A141: 140 | B141: =R[-6]C+1 -> 24 | C141: 5 | D141: + Thuốc trừ cỏ: | E141: 2022-10-26 | F141: 2
A142: 141 | B142: =R[-6]C+1 -> 24 | C142: 5 | D142: + Thuốc trừ bệnh: | E142: 2022-10-26 | F142: 3
A143: 142 | B143: =R[-6]C+1 -> 24 | C143: 5 | D143: + Phối hợp thuốc (trừ sâu - bệnh): | E143: 2022-10-26 | F143: 4
A144: 143 | B144: =R[-6]C+1 -> 24 | C144: 5 | D144: + Phối hợp thuốc (trừ rầy - bệnh): | E144: 2022-10-26 | F144: 5
A145: 144 | B145: =R[-6]C+1 -> 24 | C145: 5 | D145: + Phun theo thời điểm: | E145: 2022-10-26 | F145: 6
A146: 145 | B146: =R[-6]C+1 -> 25 | C146: 5 | D146: + Thuốc trừ ốc: | E146: 2022-10-26 | F146: 1
A147: 146 | B147: =R[-6]C+1 -> 25 | C147: 5 | D147: + Thuốc trừ cỏ: | E147: 2022-10-26 | F147: 2
A148: 147 | B148: =R[-6]C+1 -> 25 | C148: 5 | D148: + Thuốc trừ bệnh: | E148: 2022-10-26 | F148: 3
A149: 148 | B149: =R[-6]C+1 -> 25 | C149: 5 | D149: + Phối hợp thuốc (trừ sâu - bệnh): | E149: 2022-10-26 | F149: 4
A150: 149 | B150: =R[-6]C+1 -> 25 | C150: 5 | D150: + Phối hợp thuốc (trừ rầy - bệnh): | E150: 2022-10-26 | F150: 5
A151: 150 | B151: =R[-6]C+1 -> 25 | C151: 5 | D151: + Phun theo thời điểm: | E151: 2022-10-26 | F151: 6
A152: 151 | B152: =R[-6]C+1 -> 26 | C152: 5 | D152: + Thuốc trừ ốc: | E152: 2022-10-26 | F152: 1
A153: 152 | B153: =R[-6]C+1 -> 26 | C153: 5 | D153: + Thuốc trừ cỏ: | E153: 2022-10-26 | F153: 2
A154: 153 | B154: =R[-6]C+1 -> 26 | C154: 5 | D154: + Thuốc trừ bệnh: | E154: 2022-10-26 | F154: 3
A155: 154 | B155: =R[-6]C+1 -> 26 | C155: 5 | D155: + Phối hợp thuốc (trừ sâu - bệnh): | E155: 2022-10-26 | F155: 4
A156: 155 | B156: =R[-6]C+1 -> 26 | C156: 5 | D156: + Phối hợp thuốc (trừ rầy - bệnh): | E156: 2022-10-26 | F156: 5
A157: 156 | B157: =R[-6]C+1 -> 26 | C157: 5 | D157: + Phun theo thời điểm: | E157: 2022-10-26 | F157: 6
A158: 157 | B158: =R[-6]C+1 -> 27 | C158: 5 | D158: + Thuốc trừ ốc: | E158: 2022-10-26 | F158: 1
A159: 158 | B159: =R[-6]C+1 -> 27 | C159: 5 | D159: + Thuốc trừ cỏ: | E159: 2022-10-26 | F159: 2
A160: 159 | B160: =R[-6]C+1 -> 27 | C160: 5 | D160: + Thuốc trừ bệnh: | E160: 2022-10-26 | F160: 3
A161: 160 | B161: =R[-6]C+1 -> 27 | C161: 5 | D161: + Phối hợp thuốc (trừ sâu - bệnh): | E161: 2022-10-26 | F161: 4
A162: 161 | B162: =R[-6]C+1 -> 27 | C162: 5 | D162: + Phối hợp thuốc (trừ rầy - bệnh): | E162: 2022-10-26 | F162: 5
A163: 162 | B163: =R[-6]C+1 -> 27 | C163: 5 | D163: + Phun theo thời điểm: | E163: 2022-10-26 | F163: 6
A164: 163 | B164: =R[-6]C+1 -> 28 | C164: 5 | D164: + Thuốc trừ ốc: | E164: 2022-10-26 | F164: 1
A165: 164 | B165: =R[-6]C+1 -> 28 | C165: 5 | D165: + Thuốc trừ cỏ: | E165: 2022-10-26 | F165: 2
A166: 165 | B166: =R[-6]C+1 -> 28 | C166: 5 | D166: + Thuốc trừ bệnh: | E166: 2022-10-26 | F166: 3
A167: 166 | B167: =R[-6]C+1 -> 28 | C167: 5 | D167: + Phối hợp thuốc (trừ sâu - bệnh): | E167: 2022-10-26 | F167: 4
A168: 167 | B168: =R[-6]C+1 -> 28 | C168: 5 | D168: + Phối hợp thuốc (trừ rầy - bệnh): | E168: 2022-10-26 | F168: 5
A169: 168 | B169: =R[-6]C+1 -> 28 | C169: 5 | D169: + Phun theo thời điểm: | E169: 2022-10-26 | F169: 6
A170: 169 | B170: =R[-6]C+1 -> 29 | C170: 5 | D170: + Thuốc trừ ốc: | E170: 2022-10-26 | F170: 1
A171: 170 | B171: =R[-6]C+1 -> 29 | C171: 5 | D171: + Thuốc trừ cỏ: | E171: 2022-10-26 | F171: 2
A172: 171 | B172: =R[-6]C+1 -> 29 | C172: 5 | D172: + Thuốc trừ bệnh: | E172: 2022-10-26 | F172: 3
A173: 172 | B173: =R[-6]C+1 -> 29 | C173: 5 | D173: + Phối hợp thuốc (trừ sâu - bệnh): | E173: 2022-10-26 | F173: 4
A174: 173 | B174: =R[-6]C+1 -> 29 | C174: 5 | D174: + Phối hợp thuốc (trừ rầy - bệnh): | E174: 2022-10-26 | F174: 5
A175: 174 | B175: =R[-6]C+1 -> 29 | C175: 5 | D175: + Phun theo thời điểm: | E175: 2022-10-26 | F175: 6
A176: 175 | B176: =R[-6]C+1 -> 30 | C176: 5 | D176: + Thuốc trừ ốc: | E176: 2022-10-26 | F176: 1
A177: 176 | B177: =R[-6]C+1 -> 30 | C177: 5 | D177: + Thuốc trừ cỏ: | E177: 2022-10-26 | F177: 2
A178: 177 | B178: =R[-6]C+1 -> 30 | C178: 5 | D178: + Thuốc trừ bệnh: | E178: 2022-10-26 | F178: 3
A179: 178 | B179: =R[-6]C+1 -> 30 | C179: 5 | D179: + Phối hợp thuốc (trừ sâu - bệnh): | E179: 2022-10-26 | F179: 4
A180: 179 | B180: =R[-6]C+1 -> 30 | C180: 5 | D180: + Phối hợp thuốc (trừ rầy - bệnh): | E180: 2022-10-26 | F180: 5
A181: 180 | B181: =R[-6]C+1 -> 30 | C181: 5 | D181: + Phun theo thời điểm: | E181: 2022-10-26 | F181: 6
A182: 181 | B182: =R[-6]C+1 -> 31 | C182: 5 | D182: + Thuốc trừ ốc: | E182: 2022-10-26 | F182: 1
A183: 182 | B183: =R[-6]C+1 -> 31 | C183: 5 | D183: + Thuốc trừ cỏ: | E183: 2022-10-26 | F183: 2
A184: 183 | B184: =R[-6]C+1 -> 31 | C184: 5 | D184: + Thuốc trừ bệnh: | E184: 2022-10-26 | F184: 3
A185: 184 | B185: =R[-6]C+1 -> 31 | C185: 5 | D185: + Phối hợp thuốc (trừ sâu - bệnh): | E185: 2022-10-26 | F185: 4
A186: 185 | B186: =R[-6]C+1 -> 31 | C186: 5 | D186: + Phối hợp thuốc (trừ rầy - bệnh): | E186: 2022-10-26 | F186: 5
A187: 186 | B187: =R[-6]C+1 -> 31 | C187: 5 | D187: + Phun theo thời điểm: | E187: 2022-10-26 | F187: 6
A188: 187 | B188: =R[-6]C+1 -> 32 | C188: 5 | D188: + Thuốc trừ ốc: | E188: 2022-10-26 | F188: 1
A189: 188 | B189: =R[-6]C+1 -> 32 | C189: 5 | D189: + Thuốc trừ cỏ: | E189: 2022-10-26 | F189: 2
A190: 189 | B190: =R[-6]C+1 -> 32 | C190: 5 | D190: + Thuốc trừ bệnh: | E190: 2022-10-26 | F190: 3
A191: 190 | B191: =R[-6]C+1 -> 32 | C191: 5 | D191: + Phối hợp thuốc (trừ sâu - bệnh): | E191: 2022-10-26 | F191: 4
A192: 191 | B192: =R[-6]C+1 -> 32 | C192: 5 | D192: + Phối hợp thuốc (trừ rầy - bệnh): | E192: 2022-10-26 | F192: 5
A193: 192 | B193: =R[-6]C+1 -> 32 | C193: 5 | D193: + Phun theo thời điểm: | E193: 2022-10-26 | F193: 6
A194: 193 | B194: =R[-6]C+1 -> 33 | C194: 5 | D194: + Thuốc trừ ốc: | E194: 2022-10-26 | F194: 1
A195: 194 | B195: =R[-6]C+1 -> 33 | C195: 5 | D195: + Thuốc trừ cỏ: | E195: 2022-10-26 | F195: 2
A196: 195 | B196: =R[-6]C+1 -> 33 | C196: 5 | D196: + Thuốc trừ bệnh: | E196: 2022-10-26 | F196: 3
A197: 196 | B197: =R[-6]C+1 -> 33 | C197: 5 | D197: + Phối hợp thuốc (trừ sâu - bệnh): | E197: 2022-10-26 | F197: 4
A198: 197 | B198: =R[-6]C+1 -> 33 | C198: 5 | D198: + Phối hợp thuốc (trừ rầy - bệnh): | E198: 2022-10-26 | F198: 5
A199: 198 | B199: =R[-6]C+1 -> 33 | C199: 5 | D199: + Phun theo thời điểm: | E199: 2022-10-26 | F199: 6
A200: 199 | B200: =R[-6]C+1 -> 34 | C200: 5 | D200: + Thuốc trừ ốc: | E200: 2022-10-26 | F200: 1
A201: 200 | B201: =R[-6]C+1 -> 34 | C201: 5 | D201: + Thuốc trừ cỏ: | E201: 2022-10-26 | F201: 2
A202: 201 | B202: =R[-6]C+1 -> 34 | C202: 5 | D202: + Thuốc trừ bệnh: | E202: 2022-10-26 | F202: 3
A203: 202 | B203: =R[-6]C+1 -> 34 | C203: 5 | D203: + Phối hợp thuốc (trừ sâu - bệnh): | E203: 2022-10-26 | F203: 4
A204: 203 | B204: =R[-6]C+1 -> 34 | C204: 5 | D204: + Phối hợp thuốc (trừ rầy - bệnh): | E204: 2022-10-26 | F204: 5
A205: 204 | B205: =R[-6]C+1 -> 34 | C205: 5 | D205: + Phun theo thời điểm: | E205: 2022-10-26 | F205: 6
A206: 205 | B206: =R[-6]C+1 -> 35 | C206: 5 | D206: + Thuốc trừ ốc: | E206: 2022-10-26 | F206: 1
A207: 206 | B207: =R[-6]C+1 -> 35 | C207: 5 | D207: + Thuốc trừ cỏ: | E207: 2022-10-26 | F207: 2
A208: 207 | B208: =R[-6]C+1 -> 35 | C208: 5 | D208: + Thuốc trừ bệnh: | E208: 2022-10-26 | F208: 3
A209: 208 | B209: =R[-6]C+1 -> 35 | C209: 5 | D209: + Phối hợp thuốc (trừ sâu - bệnh): | E209: 2022-10-26 | F209: 4
A210: 209 | B210: =R[-6]C+1 -> 35 | C210: 5 | D210: + Phối hợp thuốc (trừ rầy - bệnh): | E210: 2022-10-26 | F210: 5
A211: 210 | B211: =R[-6]C+1 -> 35 | C211: 5 | D211: + Phun theo thời điểm: | E211: 2022-10-26 | F211: 6
A212: 211 | B212: =R[-6]C+1 -> 36 | C212: 5 | D212: + Thuốc trừ ốc: | E212: 2022-10-26 | F212: 1
A213: 212 | B213: =R[-6]C+1 -> 36 | C213: 5 | D213: + Thuốc trừ cỏ: | E213: 2022-10-26 | F213: 2
A214: 213 | B214: =R[-6]C+1 -> 36 | C214: 5 | D214: + Thuốc trừ bệnh: | E214: 2022-10-26 | F214: 3
A215: 214 | B215: =R[-6]C+1 -> 36 | C215: 5 | D215: + Phối hợp thuốc (trừ sâu - bệnh): | E215: 2022-10-26 | F215: 4
A216: 215 | B216: =R[-6]C+1 -> 36 | C216: 5 | D216: + Phối hợp thuốc (trừ rầy - bệnh): | E216: 2022-10-26 | F216: 5
A217: 216 | B217: =R[-6]C+1 -> 36 | C217: 5 | D217: + Phun theo thời điểm: | E217: 2022-10-26 | F217: 6
A218: 217 | B218: =R[-6]C+1 -> 37 | C218: 5 | D218: + Thuốc trừ ốc: | E218: 2022-10-26 | F218: 1
A219: 218 | B219: =R[-6]C+1 -> 37 | C219: 5 | D219: + Thuốc trừ cỏ: | E219: 2022-10-26 | F219: 2
A220: 219 | B220: =R[-6]C+1 -> 37 | C220: 5 | D220: + Thuốc trừ bệnh: | E220: 2022-10-26 | F220: 3
A221: 220 | B221: =R[-6]C+1 -> 37 | C221: 5 | D221: + Phối hợp thuốc (trừ sâu - bệnh): | E221: 2022-10-26 | F221: 4
A222: 221 | B222: =R[-6]C+1 -> 37 | C222: 5 | D222: + Phối hợp thuốc (trừ rầy - bệnh): | E222: 2022-10-26 | F222: 5
A223: 222 | B223: =R[-6]C+1 -> 37 | C223: 5 | D223: + Phun theo thời điểm: | E223: 2022-10-26 | F223: 6
A224: 223 | B224: =R[-6]C+1 -> 38 | C224: 5 | D224: + Thuốc trừ ốc: | E224: 2022-10-26 | F224: 1
A225: 224 | B225: =R[-6]C+1 -> 38 | C225: 5 | D225: + Thuốc trừ cỏ: | E225: 2022-10-26 | F225: 2
A226: 225 | B226: =R[-6]C+1 -> 38 | C226: 5 | D226: + Thuốc trừ bệnh: | E226: 2022-10-26 | F226: 3
A227: 226 | B227: =R[-6]C+1 -> 38 | C227: 5 | D227: + Phối hợp thuốc (trừ sâu - bệnh): | E227: 2022-10-26 | F227: 4
A228: 227 | B228: =R[-6]C+1 -> 38 | C228: 5 | D228: + Phối hợp thuốc (trừ rầy - bệnh): | E228: 2022-10-26 | F228: 5
A229: 228 | B229: =R[-6]C+1 -> 38 | C229: 5 | D229: + Phun theo thời điểm: | E229: 2022-10-26 | F229: 6
A230: 229 | B230: =R[-6]C+1 -> 39 | C230: 5 | D230: + Thuốc trừ ốc: | E230: 2022-10-26 | F230: 1
A231: 230 | B231: =R[-6]C+1 -> 39 | C231: 5 | D231: + Thuốc trừ cỏ: | E231: 2022-10-26 | F231: 2
A232: 231 | B232: =R[-6]C+1 -> 39 | C232: 5 | D232: + Thuốc trừ bệnh: | E232: 2022-10-26 | F232: 3
A233: 232 | B233: =R[-6]C+1 -> 39 | C233: 5 | D233: + Phối hợp thuốc (trừ sâu - bệnh): | E233: 2022-10-26 | F233: 4
A234: 233 | B234: =R[-6]C+1 -> 39 | C234: 5 | D234: + Phối hợp thuốc (trừ rầy - bệnh): | E234: 2022-10-26 | F234: 5
A235: 234 | B235: =R[-6]C+1 -> 39 | C235: 5 | D235: + Phun theo thời điểm: | E235: 2022-10-26 | F235: 6
A236: 235 | B236: =R[-6]C+1 -> 40 | C236: 5 | D236: + Thuốc trừ ốc: | E236: 2022-10-26 | F236: 1
A237: 236 | B237: =R[-6]C+1 -> 40 | C237: 5 | D237: + Thuốc trừ cỏ: | E237: 2022-10-26 | F237: 2
A238: 237 | B238: =R[-6]C+1 -> 40 | C238: 5 | D238: + Thuốc trừ bệnh: | E238: 2022-10-26 | F238: 3
A239: 238 | B239: =R[-6]C+1 -> 40 | C239: 5 | D239: + Phối hợp thuốc (trừ sâu - bệnh): | E239: 2022-10-26 | F239: 4
A240: 239 | B240: =R[-6]C+1 -> 40 | C240: 5 | D240: + Phối hợp thuốc (trừ rầy - bệnh): | E240: 2022-10-26 | F240: 5
A241: 240 | B241: =R[-6]C+1 -> 40 | C241: 5 | D241: + Phun theo thời điểm: | E241: 2022-10-26 | F241: 6
A242: 241 | B242: =R[-6]C+1 -> 41 | C242: 5 | D242: + Thuốc trừ ốc: | E242: 2022-10-26 | F242: 1
A243: 242 | B243: =R[-6]C+1 -> 41 | C243: 5 | D243: + Thuốc trừ cỏ: | E243: 2022-10-26 | F243: 2
A244: 243 | B244: =R[-6]C+1 -> 41 | C244: 5 | D244: + Thuốc trừ bệnh: | E244: 2022-10-26 | F244: 3
A245: 244 | B245: =R[-6]C+1 -> 41 | C245: 5 | D245: + Phối hợp thuốc (trừ sâu - bệnh): | E245: 2022-10-26 | F245: 4
A246: 245 | B246: =R[-6]C+1 -> 41 | C246: 5 | D246: + Phối hợp thuốc (trừ rầy - bệnh): | E246: 2022-10-26 | F246: 5
A247: 246 | B247: =R[-6]C+1 -> 41 | C247: 5 | D247: + Phun theo thời điểm: | E247: 2022-10-26 | F247: 6
A248: 247 | B248: =R[-6]C+1 -> 42 | C248: 5 | D248: + Thuốc trừ ốc: | E248: 2022-10-26 | F248: 1
A249: 248 | B249: =R[-6]C+1 -> 42 | C249: 5 | D249: + Thuốc trừ cỏ: | E249: 2022-10-26 | F249: 2
A250: 249 | B250: =R[-6]C+1 -> 42 | C250: 5 | D250: + Thuốc trừ bệnh: | E250: 2022-10-26 | F250: 3
A251: 250 | B251: =R[-6]C+1 -> 42 | C251: 5 | D251: + Phối hợp thuốc (trừ sâu - bệnh): | E251: 2022-10-26 | F251: 4
A252: 251 | B252: =R[-6]C+1 -> 42 | C252: 5 | D252: + Phối hợp thuốc (trừ rầy - bệnh): | E252: 2022-10-26 | F252: 5
A253: 252 | B253: =R[-6]C+1 -> 42 | C253: 5 | D253: + Phun theo thời điểm: | E253: 2022-10-26 | F253: 6
A254: 253 | B254: =R[-6]C+1 -> 43 | C254: 5 | D254: + Thuốc trừ ốc: | E254: 2022-10-26 | F254: 1
A255: 254 | B255: =R[-6]C+1 -> 43 | C255: 5 | D255: + Thuốc trừ cỏ: | E255: 2022-10-26 | F255: 2
A256: 255 | B256: =R[-6]C+1 -> 43 | C256: 5 | D256: + Thuốc trừ bệnh: | E256: 2022-10-26 | F256: 3
A257: 256 | B257: =R[-6]C+1 -> 43 | C257: 5 | D257: + Phối hợp thuốc (trừ sâu - bệnh): | E257: 2022-10-26 | F257: 4
A258: 257 | B258: =R[-6]C+1 -> 43 | C258: 5 | D258: + Phối hợp thuốc (trừ rầy - bệnh): | E258: 2022-10-26 | F258: 5
A259: 258 | B259: =R[-6]C+1 -> 43 | C259: 5 | D259: + Phun theo thời điểm: | E259: 2022-10-26 | F259: 6
A260: 259 | B260: =R[-6]C+1 -> 44 | C260: 5 | D260: + Thuốc trừ ốc: | E260: 2022-10-26 | F260: 1
A261: 260 | B261: =R[-6]C+1 -> 44 | C261: 5 | D261: + Thuốc trừ cỏ: | E261: 2022-10-26 | F261: 2
A262: 261 | B262: =R[-6]C+1 -> 44 | C262: 5 | D262: + Thuốc trừ bệnh: | E262: 2022-10-26 | F262: 3
A263: 262 | B263: =R[-6]C+1 -> 44 | C263: 5 | D263: + Phối hợp thuốc (trừ sâu - bệnh): | E263: 2022-10-26 | F263: 4
A264: 263 | B264: =R[-6]C+1 -> 44 | C264: 5 | D264: + Phối hợp thuốc (trừ rầy - bệnh): | E264: 2022-10-26 | F264: 5
A265: 264 | B265: =R[-6]C+1 -> 44 | C265: 5 | D265: + Phun theo thời điểm: | E265: 2022-10-26 | F265: 6
A266: 265 | B266: =R[-6]C+1 -> 45 | C266: 5 | D266: + Thuốc trừ ốc: | E266: 2022-10-26 | F266: 1
A267: 266 | B267: =R[-6]C+1 -> 45 | C267: 5 | D267: + Thuốc trừ cỏ: | E267: 2022-10-26 | F267: 2
A268: 267 | B268: =R[-6]C+1 -> 45 | C268: 5 | D268: + Thuốc trừ bệnh: | E268: 2022-10-26 | F268: 3
A269: 268 | B269: =R[-6]C+1 -> 45 | C269: 5 | D269: + Phối hợp thuốc (trừ sâu - bệnh): | E269: 2022-10-26 | F269: 4
A270: 269 | B270: =R[-6]C+1 -> 45 | C270: 5 | D270: + Phối hợp thuốc (trừ rầy - bệnh): | E270: 2022-10-26 | F270: 5
A271: 270 | B271: =R[-6]C+1 -> 45 | C271: 5 | D271: + Phun theo thời điểm: | E271: 2022-10-26 | F271: 6
A272: 271 | B272: =R[-6]C+1 -> 46 | C272: 5 | D272: + Thuốc trừ ốc: | E272: 2022-10-26 | F272: 1
A273: 272 | B273: =R[-6]C+1 -> 46 | C273: 5 | D273: + Thuốc trừ cỏ: | E273: 2022-10-26 | F273: 2
A274: 273 | B274: =R[-6]C+1 -> 46 | C274: 5 | D274: + Thuốc trừ bệnh: | E274: 2022-10-26 | F274: 3
A275: 274 | B275: =R[-6]C+1 -> 46 | C275: 5 | D275: + Phối hợp thuốc (trừ sâu - bệnh): | E275: 2022-10-26 | F275: 4
A276: 275 | B276: =R[-6]C+1 -> 46 | C276: 5 | D276: + Phối hợp thuốc (trừ rầy - bệnh): | E276: 2022-10-26 | F276: 5
A277: 276 | B277: =R[-6]C+1 -> 46 | C277: 5 | D277: + Phun theo thời điểm: | E277: 2022-10-26 | F277: 6
A278: 277 | B278: =R[-6]C+1 -> 47 | C278: 5 | D278: + Thuốc trừ ốc: | E278: 2022-10-26 | F278: 1
A279: 278 | B279: =R[-6]C+1 -> 47 | C279: 5 | D279: + Thuốc trừ cỏ: | E279: 2022-10-26 | F279: 2
A280: 279 | B280: =R[-6]C+1 -> 47 | C280: 5 | D280: + Thuốc trừ bệnh: | E280: 2022-10-26 | F280: 3
A281: 280 | B281: =R[-6]C+1 -> 47 | C281: 5 | D281: + Phối hợp thuốc (trừ sâu - bệnh): | E281: 2022-10-26 | F281: 4
A282: 281 | B282: =R[-6]C+1 -> 47 | C282: 5 | D282: + Phối hợp thuốc (trừ rầy - bệnh): | E282: 2022-10-26 | F282: 5
A283: 282 | B283: =R[-6]C+1 -> 47 | C283: 5 | D283: + Phun theo thời điểm: | E283: 2022-10-26 | F283: 6
A284: 283 | B284: =R[-6]C+1 -> 48 | C284: 5 | D284: + Thuốc trừ ốc: | E284: 2022-10-26 | F284: 1
A285: 284 | B285: =R[-6]C+1 -> 48 | C285: 5 | D285: + Thuốc trừ cỏ: | E285: 2022-10-26 | F285: 2
A286: 285 | B286: =R[-6]C+1 -> 48 | C286: 5 | D286: + Thuốc trừ bệnh: | E286: 2022-10-26 | F286: 3
A287: 286 | B287: =R[-6]C+1 -> 48 | C287: 5 | D287: + Phối hợp thuốc (trừ sâu - bệnh): | E287: 2022-10-26 | F287: 4
A288: 287 | B288: =R[-6]C+1 -> 48 | C288: 5 | D288: + Phối hợp thuốc (trừ rầy - bệnh): | E288: 2022-10-26 | F288: 5
A289: 288 | B289: =R[-6]C+1 -> 48 | C289: 5 | D289: + Phun theo thời điểm: | E289: 2022-10-26 | F289: 6
A290: 289 | B290: =R[-6]C+1 -> 49 | C290: 5 | D290: + Thuốc trừ ốc: | E290: 2022-10-26 | F290: 1
A291: 290 | B291: =R[-6]C+1 -> 49 | C291: 5 | D291: + Thuốc trừ cỏ: | E291: 2022-10-26 | F291: 2
A292: 291 | B292: =R[-6]C+1 -> 49 | C292: 5 | D292: + Thuốc trừ bệnh: | E292: 2022-10-26 | F292: 3
A293: 292 | B293: =R[-6]C+1 -> 49 | C293: 5 | D293: + Phối hợp thuốc (trừ sâu - bệnh): | E293: 2022-10-26 | F293: 4
A294: 293 | B294: =R[-6]C+1 -> 49 | C294: 5 | D294: + Phối hợp thuốc (trừ rầy - bệnh): | E294: 2022-10-26 | F294: 5
A295: 294 | B295: =R[-6]C+1 -> 49 | C295: 5 | D295: + Phun theo thời điểm: | E295: 2022-10-26 | F295: 6
A296: 295 | B296: =R[-6]C+1 -> 50 | C296: 5 | D296: + Thuốc trừ ốc: | E296: 2022-10-26 | F296: 1
A297: 296 | B297: =R[-6]C+1 -> 50 | C297: 5 | D297: + Thuốc trừ cỏ: | E297: 2022-10-26 | F297: 2
A298: 297 | B298: =R[-6]C+1 -> 50 | C298: 5 | D298: + Thuốc trừ bệnh: | E298: 2022-10-26 | F298: 3
A299: 298 | B299: =R[-6]C+1 -> 50 | C299: 5 | D299: + Phối hợp thuốc (trừ sâu - bệnh): | E299: 2022-10-26 | F299: 4
A300: 299 | B300: =R[-6]C+1 -> 50 | C300: 5 | D300: + Phối hợp thuốc (trừ rầy - bệnh): | E300: 2022-10-26 | F300: 5
A301: 300 | B301: =R[-6]C+1 -> 50 | C301: 5 | D301: + Phun theo thời điểm: | E301: 2022-10-26 | F301: 6