Sheet: Sheet1
A1: ID | B1: IDVUNGTRONG | C1: IDNHATKY | D1: SUDUNGTHUOC | E1: NGAYTHUCHIEN | F1: SAPXEP | G1: GHICHU
A2: 1 | B2: 1 | C2: 5 | D2: + Thuốc trừ ốc: | E2: 2022-10-26T00:00:00.000 | F2: 1
A3: 2 | B3: 1 | C3: 5 | D3: + Thuốc trừ cỏ: | E3: 2022-10-26T00:00:00.000 | F3: 2
A4: 3 | B4: 1 | C4: 5 | D4: + Thuốc trừ bệnh: | E4: 2022-10-26T00:00:00.000 | F4: 3
A5: 4 | B5: 1 | C5: 5 | D5: + Phối hợp thuốc (trừ sâu - bệnh): | E5: 2022-10-26T00:00:00.000 | F5: 4
A6: 5 | B6: 1 | C6: 5 | D6: + Phối hợp thuốc (trừ rầy - bệnh): | E6: 2022-10-26T00:00:00.000 | F6: 5
A7: 6 | B7: 1 | C7: 5 | D7: + Phun theo thời điểm: | E7: 2022-10-26T00:00:00.000 | F7: 6
A8: 7 | B8: =R[-6]C+1 -> 2 | C8: 5 | D8: + Thuốc trừ ốc: | E8: 2022-10-26T00:00:00.000 | F8: 1
A9: 8 | B9: =R[-6]C+1 -> 2 | C9: 5 | D9: + Thuốc trừ cỏ: | E9: 2022-10-26T00:00:00.000 | F9: 2
A10: 9 | B10: =R[-6]C+1 -> 2 | C10: 5 | D10: + Thuốc trừ bệnh: | E10: 2022-10-26T00:00:00.000 | F10: 3
A11: 10 | B11: =R[-6]C+1 -> 2 | C11: 5 | D11: + Phối hợp thuốc (trừ sâu - bệnh): | E11: 2022-10-26T00:00:00.000 | F11: 4
A12: 11 | B12: =R[-6]C+1 -> 2 | C12: 5 | D12: + Phối hợp thuốc (trừ rầy - bệnh): | E12: 2022-10-26T00:00:00.000 | F12: 5
A13: 12 | B13: =R[-6]C+1 -> 2 | C13: 5 | D13: + Phun theo thời điểm: | E13: 2022-10-26T00:00:00.000 | F13: 6
A14: 13 | B14: =R[-6]C+1 -> 3 | C14: 5 | D14: + Thuốc trừ ốc: | E14: 2022-10-26T00:00:00.000 | F14: 1
A15: 14 | B15: =R[-6]C+1 -> 3 | C15: 5 | D15: + Thuốc trừ cỏ: | E15: 2022-10-26T00:00:00.000 | F15: 2
A16: 15 | B16: =R[-6]C+1 -> 3 | C16: 5 | D16: + Thuốc trừ bệnh: | E16: 2022-10-26T00:00:00.000 | F16: 3
A17: 16 | B17: =R[-6]C+1 -> 3 | C17: 5 | D17: + Phối hợp thuốc (trừ sâu - bệnh): | E17: 2022-10-26T00:00:00.000 | F17: 4
A18: 17 | B18: =R[-6]C+1 -> 3 | C18: 5 | D18: + Phối hợp thuốc (trừ rầy - bệnh): | E18: 2022-10-26T00:00:00.000 | F18: 5
A19: 18 | B19: =R[-6]C+1 -> 3 | C19: 5 | D19: + Phun theo thời điểm: | E19: 2022-10-26T00:00:00.000 | F19: 6
A20: 19 | B20: =R[-6]C+1 -> 4 | C20: 5 | D20: + Thuốc trừ ốc: | E20: 2022-10-26T00:00:00.000 | F20: 1
A21: 20 | B21: =R[-6]C+1 -> 4 | C21: 5 | D21: + Thuốc trừ cỏ: | E21: 2022-10-26T00:00:00.000 | F21: 2
A22: 21 | B22: =R[-6]C+1 -> 4 | C22: 5 | D22: + Thuốc trừ bệnh: | E22: 2022-10-26T00:00:00.000 | F22: 3
A23: 22 | B23: =R[-6]C+1 -> 4 | C23: 5 | D23: + Phối hợp thuốc (trừ sâu - bệnh): | E23: 2022-10-26T00:00:00.000 | F23: 4
A24: 23 | B24: =R[-6]C+1 -> 4 | C24: 5 | D24: + Phối hợp thuốc (trừ rầy - bệnh): | E24: 2022-10-26T00:00:00.000 | F24: 5
A25: 24 | B25: =R[-6]C+1 -> 4 | C25: 5 | D25: + Phun theo thời điểm: | E25: 2022-10-26T00:00:00.000 | F25: 6
A26: 25 | B26: =R[-6]C+1 -> 5 | C26: 5 | D26: + Thuốc trừ ốc: | E26: 2022-10-26T00:00:00.000 | F26: 1
A27: 26 | B27: =R[-6]C+1 -> 5 | C27: 5 | D27: + Thuốc trừ cỏ: | E27: 2022-10-26T00:00:00.000 | F27: 2
A28: 27 | B28: =R[-6]C+1 -> 5 | C28: 5 | D28: + Thuốc trừ bệnh: | E28: 2022-10-26T00:00:00.000 | F28: 3
A29: 28 | B29: =R[-6]C+1 -> 5 | C29: 5 | D29: + Phối hợp thuốc (trừ sâu - bệnh): | E29: 2022-10-26T00:00:00.000 | F29: 4
A30: 29 | B30: =R[-6]C+1 -> 5 | C30: 5 | D30: + Phối hợp thuốc (trừ rầy - bệnh): | E30: 2022-10-26T00:00:00.000 | F30: 5
A31: 30 | B31: =R[-6]C+1 -> 5 | C31: 5 | D31: + Phun theo thời điểm: | E31: 2022-10-26T00:00:00.000 | F31: 6
A32: 31 | B32: =R[-6]C+1 -> 6 | C32: 5 | D32: + Thuốc trừ ốc: | E32: 2022-10-26T00:00:00.000 | F32: 1
A33: 32 | B33: =R[-6]C+1 -> 6 | C33: 5 | D33: + Thuốc trừ cỏ: | E33: 2022-10-26T00:00:00.000 | F33: 2
A34: 33 | B34: =R[-6]C+1 -> 6 | C34: 5 | D34: + Thuốc trừ bệnh: | E34: 2022-10-26T00:00:00.000 | F34: 3
A35: 34 | B35: =R[-6]C+1 -> 6 | C35: 5 | D35: + Phối hợp thuốc (trừ sâu - bệnh): | E35: 2022-10-26T00:00:00.000 | F35: 4
A36: 35 | B36: =R[-6]C+1 -> 6 | C36: 5 | D36: + Phối hợp thuốc (trừ rầy - bệnh): | E36: 2022-10-26T00:00:00.000 | F36: 5
A37: 36 | B37: =R[-6]C+1 -> 6 | C37: 5 | D37: + Phun theo thời điểm: | E37: 2022-10-26T00:00:00.000 | F37: 6
A38: 37 | B38: =R[-6]C+1 -> 7 | C38: 5 | D38: + Thuốc trừ ốc: | E38: 2022-10-26T00:00:00.000 | F38: 1
A39: 38 | B39: =R[-6]C+1 -> 7 | C39: 5 | D39: + Thuốc trừ cỏ: | E39: 2022-10-26T00:00:00.000 | F39: 2
A40: 39 | B40: =R[-6]C+1 -> 7 | C40: 5 | D40: + Thuốc trừ bệnh: | E40: 2022-10-26T00:00:00.000 | F40: 3
A41: 40 | B41: =R[-6]C+1 -> 7 | C41: 5 | D41: + Phối hợp thuốc (trừ sâu - bệnh): | E41: 2022-10-26T00:00:00.000 | F41: 4
A42: 41 | B42: =R[-6]C+1 -> 7 | C42: 5 | D42: + Phối hợp thuốc (trừ rầy - bệnh): | E42: 2022-10-26T00:00:00.000 | F42: 5
A43: 42 | B43: =R[-6]C+1 -> 7 | C43: 5 | D43: + Phun theo thời điểm: | E43: 2022-10-26T00:00:00.000 | F43: 6
A44: 43 | B44: =R[-6]C+1 -> 8 | C44: 5 | D44: + Thuốc trừ ốc: | E44: 2022-10-26T00:00:00.000 | F44: 1
A45: 44 | B45: =R[-6]C+1 -> 8 | C45: 5 | D45: + Thuốc trừ cỏ: | E45: 2022-10-26T00:00:00.000 | F45: 2
A46: 45 | B46: =R[-6]C+1 -> 8 | C46: 5 | D46: + Thuốc trừ bệnh: | E46: 2022-10-26T00:00:00.000 | F46: 3
A47: 46 | B47: =R[-6]C+1 -> 8 | C47: 5 | D47: + Phối hợp thuốc (trừ sâu - bệnh): | E47: 2022-10-26T00:00:00.000 | F47: 4
A48: 47 | B48: =R[-6]C+1 -> 8 | C48: 5 | D48: + Phối hợp thuốc (trừ rầy - bệnh): | E48: 2022-10-26T00:00:00.000 | F48: 5
A49: 48 | B49: =R[-6]C+1 -> 8 | C49: 5 | D49: + Phun theo thời điểm: | E49: 2022-10-26T00:00:00.000 | F49: 6
A50: 49 | B50: =R[-6]C+1 -> 9 | C50: 5 | D50: + Thuốc trừ ốc: | E50: 2022-10-26T00:00:00.000 | F50: 1
A51: 50 | B51: =R[-6]C+1 -> 9 | C51: 5 | D51: + Thuốc trừ cỏ: | E51: 2022-10-26T00:00:00.000 | F51: 2
A52: 51 | B52: =R[-6]C+1 -> 9 | C52: 5 | D52: + Thuốc trừ bệnh: | E52: 2022-10-26T00:00:00.000 | F52: 3
A53: 52 | B53: =R[-6]C+1 -> 9 | C53: 5 | D53: + Phối hợp thuốc (trừ sâu - bệnh): | E53: 2022-10-26T00:00:00.000 | F53: 4
A54: 53 | B54: =R[-6]C+1 -> 9 | C54: 5 | D54: + Phối hợp thuốc (trừ rầy - bệnh): | E54: 2022-10-26T00:00:00.000 | F54: 5
A55: 54 | B55: =R[-6]C+1 -> 9 | C55: 5 | D55: + Phun theo thời điểm: | E55: 2022-10-26T00:00:00.000 | F55: 6
A56: 55 | B56: =R[-6]C+1 -> 10 | C56: 5 | D56: + Thuốc trừ ốc: | E56: 2022-10-26T00:00:00.000 | F56: 1
A57: 56 | B57: =R[-6]C+1 -> 10 | C57: 5 | D57: + Thuốc trừ cỏ: | E57: 2022-10-26T00:00:00.000 | F57: 2
A58: 57 | B58: =R[-6]C+1 -> 10 | C58: 5 | D58: + Thuốc trừ bệnh: | E58: 2022-10-26T00:00:00.000 | F58: 3
A59: 58 | B59: =R[-6]C+1 -> 10 | C59: 5 | D59: + Phối hợp thuốc (trừ sâu - bệnh): | E59: 2022-10-26T00:00:00.000 | F59: 4
A60: 59 | B60: =R[-6]C+1 -> 10 | C60: 5 | D60: + Phối hợp thuốc (trừ rầy - bệnh): | E60: 2022-10-26T00:00:00.000 | F60: 5
A61: 60 | B61: =R[-6]C+1 -> 10 | C61: 5 | D61: + Phun theo thời điểm: | E61: 2022-10-26T00:00:00.000 | F61: 6
A62: 61 | B62: =R[-6]C+1 -> 11 | C62: 5 | D62: + Thuốc trừ ốc: | E62: 2022-10-26T00:00:00.000 | F62: 1
A63: 62 | B63: =R[-6]C+1 -> 11 | C63: 5 | D63: + Thuốc trừ cỏ: | E63: 2022-10-26T00:00:00.000 | F63: 2
A64: 63 | B64: =R[-6]C+1 -> 11 | C64: 5 | D64: + Thuốc trừ bệnh: | E64: 2022-10-26T00:00:00.000 | F64: 3
A65: 64 | B65: =R[-6]C+1 -> 11 | C65: 5 | D65: + Phối hợp thuốc (trừ sâu - bệnh): | E65: 2022-10-26T00:00:00.000 | F65: 4
A66: 65 | B66: =R[-6]C+1 -> 11 | C66: 5 | D66: + Phối hợp thuốc (trừ rầy - bệnh): | E66: 2022-10-26T00:00:00.000 | F66: 5
A67: 66 | B67: =R[-6]C+1 -> 11 | C67: 5 | D67: + Phun theo thời điểm: | E67: 2022-10-26T00:00:00.000 | F67: 6