Sheet: Sheet1
A1: ID | B1: IDVUNGTRONG | C1: IDNHATKY | D1: IDKYTHUATBONPHAN | E1: TENPHANBON | F1: SOLUONG | G1: CACHSUDUNG | H1: NGAYTHUCHIEN | I1: SAPXEP | J1: GHICHU
A2: 1 | B2: 1 | C2: 4 | D2: 1 | E2: • Phân hữu cơ: | H2: 2022-09-25T00:00:00.000 | I2: 1
A3: 2 | B3: 1 | C3: 4 | D3: 1 | E3: • Phân cải tạo đất | H3: 2022-09-25T00:00:00.000 | I3: 2
A4: 3 | B4: 1 | C4: 4 | D4: 1 | E4: • Ure: | F4: 3.8 kg | H4: 2022-09-25T00:00:00.000 | I4: 3
A5: 4 | B5: 1 | C5: 4 | D5: 1 | E5: • Phân Lân: | H5: 2022-09-25T00:00:00.000 | I5: 4
A6: 5 | B6: 1 | C6: 4 | D6: 1 | E6: • Phân Kali: | H6: 2022-09-25T00:00:00.000 | I6: 5
A7: 6 | B7: 1 | C7: 4 | D7: 1 | E7: • Phân DAP: | F7: 2.5 kg | H7: 2022-09-25T00:00:00.000 | I7: 6
A8: 7 | B8: 1 | C8: 4 | D8: 1 | E8: • Phân NPK: | H8: 2022-09-25T00:00:00.000 | I8: 7
A9: 8 | B9: 1 | C9: 4 | D9: 1 | E9: • Phân Khác: | H9: 2022-09-25T00:00:00.000 | I9: 8
A10: 9 | B10: 1 | C10: 4 | D10: 2 | E10: • Phân hữu cơ: | H10: 2022-10-05T00:00:00.000 | I10: 1
A11: 10 | B11: 1 | C11: 4 | D11: 2 | E11: • Phân cải tạo đất | H11: 2022-10-05T00:00:00.000 | I11: 2
A12: 11 | B12: 1 | C12: 4 | D12: 2 | E12: • Ure: | H12: 2022-10-05T00:00:00.000 | I12: 3
A13: 12 | B13: 1 | C13: 4 | D13: 2 | E13: • Phân DAP: | H13: 2022-10-05T00:00:00.000 | I13: 4
A14: 13 | B14: 1 | C14: 4 | D14: 2 | E14: • Phân NPK: | F14: 11.5 kg | H14: 2022-10-05T00:00:00.000 | I14: 5
A15: 14 | B15: 1 | C15: 4 | D15: 2 | E15: • Phân Khác: | H15: 2022-10-05T00:00:00.000 | I15: 6
A16: 15 | B16: 1 | C16: 4 | D16: 3 | E16: • Phân hữu cơ: | H16: 2022-10-28T00:00:00.000 | I16: 1
A17: 16 | B17: 1 | C17: 4 | D17: 3 | E17: • Phân cải tạo đất | H17: 2022-10-28T00:00:00.000 | I17: 2
A18: 17 | B18: 1 | C18: 4 | D18: 3 | E18: • Ure: | H18: 2022-10-28T00:00:00.000 | I18: 3
A19: 18 | B19: 1 | C19: 4 | D19: 3 | E19: • Phân DAP: | H19: 2022-10-28T00:00:00.000 | I19: 4
A20: 19 | B20: 1 | C20: 4 | D20: 3 | E20: • Phân NPK: | F20: 11.5 kg | H20: 2022-10-28T00:00:00.000 | I20: 5
A21: 20 | B21: 1 | C21: 4 | D21: 3 | E21: • Phân Khác: | H21: 2022-10-28T00:00:00.000 | I21: 6
A22: 21 | B22: =R[-20]C+1 -> 2 | C22: 4 | D22: =R[-20]C+3 -> 4 | E22: • Phân hữu cơ: | H22: 2022-09-25T00:00:00.000 | I22: 1
A23: 22 | B23: =R[-20]C+1 -> 2 | C23: 4 | D23: =R[-20]C+3 -> 4 | E23: • Phân cải tạo đất | H23: 2022-09-25T00:00:00.000 | I23: 2
A24: 23 | B24: =R[-20]C+1 -> 2 | C24: 4 | D24: =R[-20]C+3 -> 4 | E24: • Ure: | F24: 3.8 kg | H24: 2022-09-25T00:00:00.000 | I24: 3
A25: 24 | B25: =R[-20]C+1 -> 2 | C25: 4 | D25: =R[-20]C+3 -> 4 | E25: • Phân Lân: | H25: 2022-09-25T00:00:00.000 | I25: 4
A26: 25 | B26: =R[-20]C+1 -> 2 | C26: 4 | D26: =R[-20]C+3 -> 4 | E26: • Phân Kali: | H26: 2022-09-25T00:00:00.000 | I26: 5
A27: 26 | B27: =R[-20]C+1 -> 2 | C27: 4 | D27: =R[-20]C+3 -> 4 | E27: • Phân DAP: | F27: 2.5 kg | H27: 2022-09-25T00:00:00.000 | I27: 6
A28: 27 | B28: =R[-20]C+1 -> 2 | C28: 4 | D28: =R[-20]C+3 -> 4 | E28: • Phân NPK: | H28: 2022-09-25T00:00:00.000 | I28: 7
A29: 28 | B29: =R[-20]C+1 -> 2 | C29: 4 | D29: =R[-20]C+3 -> 4 | E29: • Phân Khác: | H29: 2022-09-25T00:00:00.000 | I29: 8
A30: 29 | B30: =R[-20]C+1 -> 2 | C30: 4 | D30: =R[-20]C+3 -> 5 | E30: • Phân hữu cơ: | H30: 2022-10-05T00:00:00.000 | I30: 1
A31: 30 | B31: =R[-20]C+1 -> 2 | C31: 4 | D31: =R[-20]C+3 -> 5 | E31: • Phân cải tạo đất | H31: 2022-10-05T00:00:00.000 | I31: 2
A32: 31 | B32: =R[-20]C+1 -> 2 | C32: 4 | D32: =R[-20]C+3 -> 5 | E32: • Ure: | H32: 2022-10-05T00:00:00.000 | I32: 3
A33: 32 | B33: =R[-20]C+1 -> 2 | C33: 4 | D33: =R[-20]C+3 -> 5 | E33: • Phân DAP: | H33: 2022-10-05T00:00:00.000 | I33: 4
A34: 33 | B34: =R[-20]C+1 -> 2 | C34: 4 | D34: =R[-20]C+3 -> 5 | E34: • Phân NPK: | F34: 11.5 kg | H34: 2022-10-05T00:00:00.000 | I34: 5
A35: 34 | B35: =R[-20]C+1 -> 2 | C35: 4 | D35: =R[-20]C+3 -> 5 | E35: • Phân Khác: | H35: 2022-10-05T00:00:00.000 | I35: 6
A36: 35 | B36: =R[-20]C+1 -> 2 | C36: 4 | D36: =R[-20]C+3 -> 6 | E36: • Phân hữu cơ: | H36: 2022-10-28T00:00:00.000 | I36: 1
A37: 36 | B37: =R[-20]C+1 -> 2 | C37: 4 | D37: =R[-20]C+3 -> 6 | E37: • Phân cải tạo đất | H37: 2022-10-28T00:00:00.000 | I37: 2
A38: 37 | B38: =R[-20]C+1 -> 2 | C38: 4 | D38: =R[-20]C+3 -> 6 | E38: • Ure: | H38: 2022-10-28T00:00:00.000 | I38: 3
A39: 38 | B39: =R[-20]C+1 -> 2 | C39: 4 | D39: =R[-20]C+3 -> 6 | E39: • Phân DAP: | H39: 2022-10-28T00:00:00.000 | I39: 4
A40: 39 | B40: =R[-20]C+1 -> 2 | C40: 4 | D40: =R[-20]C+3 -> 6 | E40: • Phân NPK: | F40: 11.5 kg | H40: 2022-10-28T00:00:00.000 | I40: 5
A41: 40 | B41: =R[-20]C+1 -> 2 | C41: 4 | D41: =R[-20]C+3 -> 6 | E41: • Phân Khác: | H41: 2022-10-28T00:00:00.000 | I41: 6
A42: 41 | B42: =R[-20]C+1 -> 3 | C42: 4 | D42: =R[-20]C+3 -> 7 | E42: • Phân hữu cơ: | H42: 2022-09-25T00:00:00.000 | I42: 1
A43: 42 | B43: =R[-20]C+1 -> 3 | C43: 4 | D43: =R[-20]C+3 -> 7 | E43: • Phân cải tạo đất | H43: 2022-09-25T00:00:00.000 | I43: 2
A44: 43 | B44: =R[-20]C+1 -> 3 | C44: 4 | D44: =R[-20]C+3 -> 7 | E44: • Ure: | F44: 3.8 kg | H44: 2022-09-25T00:00:00.000 | I44: 3
A45: 44 | B45: =R[-20]C+1 -> 3 | C45: 4 | D45: =R[-20]C+3 -> 7 | E45: • Phân Lân: | H45: 2022-09-25T00:00:00.000 | I45: 4
A46: 45 | B46: =R[-20]C+1 -> 3 | C46: 4 | D46: =R[-20]C+3 -> 7 | E46: • Phân Kali: | H46: 2022-09-25T00:00:00.000 | I46: 5
A47: 46 | B47: =R[-20]C+1 -> 3 | C47: 4 | D47: =R[-20]C+3 -> 7 | E47: • Phân DAP: | F47: 2.5 kg | H47: 2022-09-25T00:00:00.000 | I47: 6
A48: 47 | B48: =R[-20]C+1 -> 3 | C48: 4 | D48: =R[-20]C+3 -> 7 | E48: • Phân NPK: | H48: 2022-09-25T00:00:00.000 | I48: 7
A49: 48 | B49: =R[-20]C+1 -> 3 | C49: 4 | D49: =R[-20]C+3 -> 7 | E49: • Phân Khác: | H49: 2022-09-25T00:00:00.000 | I49: 8
A50: 49 | B50: =R[-20]C+1 -> 3 | C50: 4 | D50: =R[-20]C+3 -> 8 | E50: • Phân hữu cơ: | H50: 2022-10-05T00:00:00.000 | I50: 1
A51: 50 | B51: =R[-20]C+1 -> 3 | C51: 4 | D51: =R[-20]C+3 -> 8 | E51: • Phân cải tạo đất | H51: 2022-10-05T00:00:00.000 | I51: 2
A52: 51 | B52: =R[-20]C+1 -> 3 | C52: 4 | D52: =R[-20]C+3 -> 8 | E52: • Ure: | H52: 2022-10-05T00:00:00.000 | I52: 3
A53: 52 | B53: =R[-20]C+1 -> 3 | C53: 4 | D53: =R[-20]C+3 -> 8 | E53: • Phân DAP: | H53: 2022-10-05T00:00:00.000 | I53: 4
A54: 53 | B54: =R[-20]C+1 -> 3 | C54: 4 | D54: =R[-20]C+3 -> 8 | E54: • Phân NPK: | F54: 11.5 kg | H54: 2022-10-05T00:00:00.000 | I54: 5
A55: 54 | B55: =R[-20]C+1 -> 3 | C55: 4 | D55: =R[-20]C+3 -> 8 | E55: • Phân Khác: | H55: 2022-10-05T00:00:00.000 | I55: 6
A56: 55 | B56: =R[-20]C+1 -> 3 | C56: 4 | D56: =R[-20]C+3 -> 9 | E56: • Phân hữu cơ: | H56: 2022-10-28T00:00:00.000 | I56: 1
A57: 56 | B57: =R[-20]C+1 -> 3 | C57: 4 | D57: =R[-20]C+3 -> 9 | E57: • Phân cải tạo đất | H57: 2022-10-28T00:00:00.000 | I57: 2
A58: 57 | B58: =R[-20]C+1 -> 3 | C58: 4 | D58: =R[-20]C+3 -> 9 | E58: • Ure: | H58: 2022-10-28T00:00:00.000 | I58: 3
A59: 58 | B59: =R[-20]C+1 -> 3 | C59: 4 | D59: =R[-20]C+3 -> 9 | E59: • Phân DAP: | H59: 2022-10-28T00:00:00.000 | I59: 4
A60: 59 | B60: =R[-20]C+1 -> 3 | C60: 4 | D60: =R[-20]C+3 -> 9 | E60: • Phân NPK: | F60: 11.5 kg | H60: 2022-10-28T00:00:00.000 | I60: 5
A61: 60 | B61: =R[-20]C+1 -> 3 | C61: 4 | D61: =R[-20]C+3 -> 9 | E61: • Phân Khác: | H61: 2022-10-28T00:00:00.000 | I61: 6
A62: 61 | B62: =R[-20]C+1 -> 4 | C62: 4 | D62: =R[-20]C+3 -> 10 | E62: • Phân hữu cơ: | H62: 2022-09-25T00:00:00.000 | I62: 1
A63: 62 | B63: =R[-20]C+1 -> 4 | C63: 4 | D63: =R[-20]C+3 -> 10 | E63: • Phân cải tạo đất | H63: 2022-09-25T00:00:00.000 | I63: 2
A64: 63 | B64: =R[-20]C+1 -> 4 | C64: 4 | D64: =R[-20]C+3 -> 10 | E64: • Ure: | F64: 3.8 kg | H64: 2022-09-25T00:00:00.000 | I64: 3
A65: 64 | B65: =R[-20]C+1 -> 4 | C65: 4 | D65: =R[-20]C+3 -> 10 | E65: • Phân Lân: | H65: 2022-09-25T00:00:00.000 | I65: 4
A66: 65 | B66: =R[-20]C+1 -> 4 | C66: 4 | D66: =R[-20]C+3 -> 10 | E66: • Phân Kali: | H66: 2022-09-25T00:00:00.000 | I66: 5
A67: 66 | B67: =R[-20]C+1 -> 4 | C67: 4 | D67: =R[-20]C+3 -> 10 | E67: • Phân DAP: | F67: 2.5 kg | H67: 2022-09-25T00:00:00.000 | I67: 6
A68: 67 | B68: =R[-20]C+1 -> 4 | C68: 4 | D68: =R[-20]C+3 -> 10 | E68: • Phân NPK: | H68: 2022-09-25T00:00:00.000 | I68: 7
A69: 68 | B69: =R[-20]C+1 -> 4 | C69: 4 | D69: =R[-20]C+3 -> 10 | E69: • Phân Khác: | H69: 2022-09-25T00:00:00.000 | I69: 8
A70: 69 | B70: =R[-20]C+1 -> 4 | C70: 4 | D70: =R[-20]C+3 -> 11 | E70: • Phân hữu cơ: | H70: 2022-10-05T00:00:00.000 | I70: 1
A71: 70 | B71: =R[-20]C+1 -> 4 | C71: 4 | D71: =R[-20]C+3 -> 11 | E71: • Phân cải tạo đất | H71: 2022-10-05T00:00:00.000 | I71: 2
A72: 71 | B72: =R[-20]C+1 -> 4 | C72: 4 | D72: =R[-20]C+3 -> 11 | E72: • Ure: | H72: 2022-10-05T00:00:00.000 | I72: 3
A73: 72 | B73: =R[-20]C+1 -> 4 | C73: 4 | D73: =R[-20]C+3 -> 11 | E73: • Phân DAP: | H73: 2022-10-05T00:00:00.000 | I73: 4
A74: 73 | B74: =R[-20]C+1 -> 4 | C74: 4 | D74: =R[-20]C+3 -> 11 | E74: • Phân NPK: | F74: 11.5 kg | H74: 2022-10-05T00:00:00.000 | I74: 5
A75: 74 | B75: =R[-20]C+1 -> 4 | C75: 4 | D75: =R[-20]C+3 -> 11 | E75: • Phân Khác: | H75: 2022-10-05T00:00:00.000 | I75: 6
A76: 75 | B76: =R[-20]C+1 -> 4 | C76: 4 | D76: =R[-20]C+3 -> 12 | E76: • Phân hữu cơ: | H76: 2022-10-28T00:00:00.000 | I76: 1
A77: 76 | B77: =R[-20]C+1 -> 4 | C77: 4 | D77: =R[-20]C+3 -> 12 | E77: • Phân cải tạo đất | H77: 2022-10-28T00:00:00.000 | I77: 2
A78: 77 | B78: =R[-20]C+1 -> 4 | C78: 4 | D78: =R[-20]C+3 -> 12 | E78: • Ure: | H78: 2022-10-28T00:00:00.000 | I78: 3
A79: 78 | B79: =R[-20]C+1 -> 4 | C79: 4 | D79: =R[-20]C+3 -> 12 | E79: • Phân DAP: | H79: 2022-10-28T00:00:00.000 | I79: 4
A80: 79 | B80: =R[-20]C+1 -> 4 | C80: 4 | D80: =R[-20]C+3 -> 12 | E80: • Phân NPK: | F80: 11.5 kg | H80: 2022-10-28T00:00:00.000 | I80: 5
A81: 80 | B81: =R[-20]C+1 -> 4 | C81: 4 | D81: =R[-20]C+3 -> 12 | E81: • Phân Khác: | H81: 2022-10-28T00:00:00.000 | I81: 6
A82: 81 | B82: =R[-20]C+1 -> 5 | C82: 4 | D82: =R[-20]C+3 -> 13 | E82: • Phân hữu cơ: | H82: 2022-09-25T00:00:00.000 | I82: 1
A83: 82 | B83: =R[-20]C+1 -> 5 | C83: 4 | D83: =R[-20]C+3 -> 13 | E83: • Phân cải tạo đất | H83: 2022-09-25T00:00:00.000 | I83: 2
A84: 83 | B84: =R[-20]C+1 -> 5 | C84: 4 | D84: =R[-20]C+3 -> 13 | E84: • Ure: | F84: 3.8 kg | H84: 2022-09-25T00:00:00.000 | I84: 3
A85: 84 | B85: =R[-20]C+1 -> 5 | C85: 4 | D85: =R[-20]C+3 -> 13 | E85: • Phân Lân: | H85: 2022-09-25T00:00:00.000 | I85: 4
A86: 85 | B86: =R[-20]C+1 -> 5 | C86: 4 | D86: =R[-20]C+3 -> 13 | E86: • Phân Kali: | H86: 2022-09-25T00:00:00.000 | I86: 5
A87: 86 | B87: =R[-20]C+1 -> 5 | C87: 4 | D87: =R[-20]C+3 -> 13 | E87: • Phân DAP: | F87: 2.5 kg | H87: 2022-09-25T00:00:00.000 | I87: 6
A88: 87 | B88: =R[-20]C+1 -> 5 | C88: 4 | D88: =R[-20]C+3 -> 13 | E88: • Phân NPK: | H88: 2022-09-25T00:00:00.000 | I88: 7
A89: 88 | B89: =R[-20]C+1 -> 5 | C89: 4 | D89: =R[-20]C+3 -> 13 | E89: • Phân Khác: | H89: 2022-09-25T00:00:00.000 | I89: 8
A90: 89 | B90: =R[-20]C+1 -> 5 | C90: 4 | D90: =R[-20]C+3 -> 14 | E90: • Phân hữu cơ: | H90: 2022-10-05T00:00:00.000 | I90: 1
A91: 90 | B91: =R[-20]C+1 -> 5 | C91: 4 | D91: =R[-20]C+3 -> 14 | E91: • Phân cải tạo đất | H91: 2022-10-05T00:00:00.000 | I91: 2
A92: 91 | B92: =R[-20]C+1 -> 5 | C92: 4 | D92: =R[-20]C+3 -> 14 | E92: • Ure: | H92: 2022-10-05T00:00:00.000 | I92: 3
A93: 92 | B93: =R[-20]C+1 -> 5 | C93: 4 | D93: =R[-20]C+3 -> 14 | E93: • Phân DAP: | H93: 2022-10-05T00:00:00.000 | I93: 4
A94: 93 | B94: =R[-20]C+1 -> 5 | C94: 4 | D94: =R[-20]C+3 -> 14 | E94: • Phân NPK: | F94: 11.5 kg | H94: 2022-10-05T00:00:00.000 | I94: 5
A95: 94 | B95: =R[-20]C+1 -> 5 | C95: 4 | D95: =R[-20]C+3 -> 14 | E95: • Phân Khác: | H95: 2022-10-05T00:00:00.000 | I95: 6
A96: 95 | B96: =R[-20]C+1 -> 5 | C96: 4 | D96: =R[-20]C+3 -> 15 | E96: • Phân hữu cơ: | H96: 2022-10-28T00:00:00.000 | I96: 1
A97: 96 | B97: =R[-20]C+1 -> 5 | C97: 4 | D97: =R[-20]C+3 -> 15 | E97: • Phân cải tạo đất | H97: 2022-10-28T00:00:00.000 | I97: 2
A98: 97 | B98: =R[-20]C+1 -> 5 | C98: 4 | D98: =R[-20]C+3 -> 15 | E98: • Ure: | H98: 2022-10-28T00:00:00.000 | I98: 3
A99: 98 | B99: =R[-20]C+1 -> 5 | C99: 4 | D99: =R[-20]C+3 -> 15 | E99: • Phân DAP: | H99: 2022-10-28T00:00:00.000 | I99: 4
A100: 99 | B100: =R[-20]C+1 -> 5 | C100: 4 | D100: =R[-20]C+3 -> 15 | E100: • Phân NPK: | F100: 11.5 kg | H100: 2022-10-28T00:00:00.000 | I100: 5
A101: 100 | B101: =R[-20]C+1 -> 5 | C101: 4 | D101: =R[-20]C+3 -> 15 | E101: • Phân Khác: | H101: 2022-10-28T00:00:00.000 | I101: 6
A102: 101 | B102: =R[-20]C+1 -> 6 | C102: 4 | D102: =R[-20]C+3 -> 16 | E102: • Phân hữu cơ: | H102: 2022-09-25T00:00:00.000 | I102: 1
A103: 102 | B103: =R[-20]C+1 -> 6 | C103: 4 | D103: =R[-20]C+3 -> 16 | E103: • Phân cải tạo đất | H103: 2022-09-25T00:00:00.000 | I103: 2
A104: 103 | B104: =R[-20]C+1 -> 6 | C104: 4 | D104: =R[-20]C+3 -> 16 | E104: • Ure: | F104: 3.8 kg | H104: 2022-09-25T00:00:00.000 | I104: 3
A105: 104 | B105: =R[-20]C+1 -> 6 | C105: 4 | D105: =R[-20]C+3 -> 16 | E105: • Phân Lân: | H105: 2022-09-25T00:00:00.000 | I105: 4
A106: 105 | B106: =R[-20]C+1 -> 6 | C106: 4 | D106: =R[-20]C+3 -> 16 | E106: • Phân Kali: | H106: 2022-09-25T00:00:00.000 | I106: 5
A107: 106 | B107: =R[-20]C+1 -> 6 | C107: 4 | D107: =R[-20]C+3 -> 16 | E107: • Phân DAP: | F107: 2.5 kg | H107: 2022-09-25T00:00:00.000 | I107: 6
A108: 107 | B108: =R[-20]C+1 -> 6 | C108: 4 | D108: =R[-20]C+3 -> 16 | E108: • Phân NPK: | H108: 2022-09-25T00:00:00.000 | I108: 7
A109: 108 | B109: =R[-20]C+1 -> 6 | C109: 4 | D109: =R[-20]C+3 -> 16 | E109: • Phân Khác: | H109: 2022-09-25T00:00:00.000 | I109: 8
A110: 109 | B110: =R[-20]C+1 -> 6 | C110: 4 | D110: =R[-20]C+3 -> 17 | E110: • Phân hữu cơ: | H110: 2022-10-05T00:00:00.000 | I110: 1
A111: 110 | B111: =R[-20]C+1 -> 6 | C111: 4 | D111: =R[-20]C+3 -> 17 | E111: • Phân cải tạo đất | H111: 2022-10-05T00:00:00.000 | I111: 2
A112: 111 | B112: =R[-20]C+1 -> 6 | C112: 4 | D112: =R[-20]C+3 -> 17 | E112: • Ure: | H112: 2022-10-05T00:00:00.000 | I112: 3
A113: 112 | B113: =R[-20]C+1 -> 6 | C113: 4 | D113: =R[-20]C+3 -> 17 | E113: • Phân DAP: | H113: 2022-10-05T00:00:00.000 | I113: 4
A114: 113 | B114: =R[-20]C+1 -> 6 | C114: 4 | D114: =R[-20]C+3 -> 17 | E114: • Phân NPK: | F114: 11.5 kg | H114: 2022-10-05T00:00:00.000 | I114: 5
A115: 114 | B115: =R[-20]C+1 -> 6 | C115: 4 | D115: =R[-20]C+3 -> 17 | E115: • Phân Khác: | H115: 2022-10-05T00:00:00.000 | I115: 6
A116: 115 | B116: =R[-20]C+1 -> 6 | C116: 4 | D116: =R[-20]C+3 -> 18 | E116: • Phân hữu cơ: | H116: 2022-10-28T00:00:00.000 | I116: 1
A117: 116 | B117: =R[-20]C+1 -> 6 | C117: 4 | D117: =R[-20]C+3 -> 18 | E117: • Phân cải tạo đất | H117: 2022-10-28T00:00:00.000 | I117: 2
A118: 117 | B118: =R[-20]C+1 -> 6 | C118: 4 | D118: =R[-20]C+3 -> 18 | E118: • Ure: | H118: 2022-10-28T00:00:00.000 | I118: 3
A119: 118 | B119: =R[-20]C+1 -> 6 | C119: 4 | D119: =R[-20]C+3 -> 18 | E119: • Phân DAP: | H119: 2022-10-28T00:00:00.000 | I119: 4
A120: 119 | B120: =R[-20]C+1 -> 6 | C120: 4 | D120: =R[-20]C+3 -> 18 | E120: • Phân NPK: | F120: 11.5 kg | H120: 2022-10-28T00:00:00.000 | I120: 5
A121: 120 | B121: =R[-20]C+1 -> 6 | C121: 4 | D121: =R[-20]C+3 -> 18 | E121: • Phân Khác: | H121: 2022-10-28T00:00:00.000 | I121: 6
A122: 121 | B122: =R[-20]C+1 -> 7 | C122: 4 | D122: =R[-20]C+3 -> 19 | E122: • Phân hữu cơ: | H122: 2022-09-25T00:00:00.000 | I122: 1
A123: 122 | B123: =R[-20]C+1 -> 7 | C123: 4 | D123: =R[-20]C+3 -> 19 | E123: • Phân cải tạo đất | H123: 2022-09-25T00:00:00.000 | I123: 2
A124: 123 | B124: =R[-20]C+1 -> 7 | C124: 4 | D124: =R[-20]C+3 -> 19 | E124: • Ure: | F124: 3.8 kg | H124: 2022-09-25T00:00:00.000 | I124: 3
A125: 124 | B125: =R[-20]C+1 -> 7 | C125: 4 | D125: =R[-20]C+3 -> 19 | E125: • Phân Lân: | H125: 2022-09-25T00:00:00.000 | I125: 4
A126: 125 | B126: =R[-20]C+1 -> 7 | C126: 4 | D126: =R[-20]C+3 -> 19 | E126: • Phân Kali: | H126: 2022-09-25T00:00:00.000 | I126: 5
A127: 126 | B127: =R[-20]C+1 -> 7 | C127: 4 | D127: =R[-20]C+3 -> 19 | E127: • Phân DAP: | F127: 2.5 kg | H127: 2022-09-25T00:00:00.000 | I127: 6
A128: 127 | B128: =R[-20]C+1 -> 7 | C128: 4 | D128: =R[-20]C+3 -> 19 | E128: • Phân NPK: | H128: 2022-09-25T00:00:00.000 | I128: 7
A129: 128 | B129: =R[-20]C+1 -> 7 | C129: 4 | D129: =R[-20]C+3 -> 19 | E129: • Phân Khác: | H129: 2022-09-25T00:00:00.000 | I129: 8
A130: 129 | B130: =R[-20]C+1 -> 7 | C130: 4 | D130: =R[-20]C+3 -> 20 | E130: • Phân hữu cơ: | H130: 2022-10-05T00:00:00.000 | I130: 1
A131: 130 | B131: =R[-20]C+1 -> 7 | C131: 4 | D131: =R[-20]C+3 -> 20 | E131: • Phân cải tạo đất | H131: 2022-10-05T00:00:00.000 | I131: 2
A132: 131 | B132: =R[-20]C+1 -> 7 | C132: 4 | D132: =R[-20]C+3 -> 20 | E132: • Ure: | H132: 2022-10-05T00:00:00.000 | I132: 3
A133: 132 | B133: =R[-20]C+1 -> 7 | C133: 4 | D133: =R[-20]C+3 -> 20 | E133: • Phân DAP: | H133: 2022-10-05T00:00:00.000 | I133: 4
A134: 133 | B134: =R[-20]C+1 -> 7 | C134: 4 | D134: =R[-20]C+3 -> 20 | E134: • Phân NPK: | F134: 11.5 kg | H134: 2022-10-05T00:00:00.000 | I134: 5
A135: 134 | B135: =R[-20]C+1 -> 7 | C135: 4 | D135: =R[-20]C+3 -> 20 | E135: • Phân Khác: | H135: 2022-10-05T00:00:00.000 | I135: 6
A136: 135 | B136: =R[-20]C+1 -> 7 | C136: 4 | D136: =R[-20]C+3 -> 21 | E136: • Phân hữu cơ: | H136: 2022-10-28T00:00:00.000 | I136: 1
A137: 136 | B137: =R[-20]C+1 -> 7 | C137: 4 | D137: =R[-20]C+3 -> 21 | E137: • Phân cải tạo đất | H137: 2022-10-28T00:00:00.000 | I137: 2
A138: 137 | B138: =R[-20]C+1 -> 7 | C138: 4 | D138: =R[-20]C+3 -> 21 | E138: • Ure: | H138: 2022-10-28T00:00:00.000 | I138: 3
A139: 138 | B139: =R[-20]C+1 -> 7 | C139: 4 | D139: =R[-20]C+3 -> 21 | E139: • Phân DAP: | H139: 2022-10-28T00:00:00.000 | I139: 4
A140: 139 | B140: =R[-20]C+1 -> 7 | C140: 4 | D140: =R[-20]C+3 -> 21 | E140: • Phân NPK: | F140: 11.5 kg | H140: 2022-10-28T00:00:00.000 | I140: 5
A141: 140 | B141: =R[-20]C+1 -> 7 | C141: 4 | D141: =R[-20]C+3 -> 21 | E141: • Phân Khác: | H141: 2022-10-28T00:00:00.000 | I141: 6
A142: 141 | B142: =R[-20]C+1 -> 8 | C142: 4 | D142: =R[-20]C+3 -> 22 | E142: • Phân hữu cơ: | H142: 2022-09-25T00:00:00.000 | I142: 1
A143: 142 | B143: =R[-20]C+1 -> 8 | C143: 4 | D143: =R[-20]C+3 -> 22 | E143: • Phân cải tạo đất | H143: 2022-09-25T00:00:00.000 | I143: 2
A144: 143 | B144: =R[-20]C+1 -> 8 | C144: 4 | D144: =R[-20]C+3 -> 22 | E144: • Ure: | F144: 3.8 kg | H144: 2022-09-25T00:00:00.000 | I144: 3
A145: 144 | B145: =R[-20]C+1 -> 8 | C145: 4 | D145: =R[-20]C+3 -> 22 | E145: • Phân Lân: | H145: 2022-09-25T00:00:00.000 | I145: 4
A146: 145 | B146: =R[-20]C+1 -> 8 | C146: 4 | D146: =R[-20]C+3 -> 22 | E146: • Phân Kali: | H146: 2022-09-25T00:00:00.000 | I146: 5
A147: 146 | B147: =R[-20]C+1 -> 8 | C147: 4 | D147: =R[-20]C+3 -> 22 | E147: • Phân DAP: | F147: 2.5 kg | H147: 2022-09-25T00:00:00.000 | I147: 6
A148: 147 | B148: =R[-20]C+1 -> 8 | C148: 4 | D148: =R[-20]C+3 -> 22 | E148: • Phân NPK: | H148: 2022-09-25T00:00:00.000 | I148: 7
A149: 148 | B149: =R[-20]C+1 -> 8 | C149: 4 | D149: =R[-20]C+3 -> 22 | E149: • Phân Khác: | H149: 2022-09-25T00:00:00.000 | I149: 8
A150: 149 | B150: =R[-20]C+1 -> 8 | C150: 4 | D150: =R[-20]C+3 -> 23 | E150: • Phân hữu cơ: | H150: 2022-10-05T00:00:00.000 | I150: 1
A151: 150 | B151: =R[-20]C+1 -> 8 | C151: 4 | D151: =R[-20]C+3 -> 23 | E151: • Phân cải tạo đất | H151: 2022-10-05T00:00:00.000 | I151: 2
A152: 151 | B152: =R[-20]C+1 -> 8 | C152: 4 | D152: =R[-20]C+3 -> 23 | E152: • Ure: | H152: 2022-10-05T00:00:00.000 | I152: 3
A153: 152 | B153: =R[-20]C+1 -> 8 | C153: 4 | D153: =R[-20]C+3 -> 23 | E153: • Phân DAP: | H153: 2022-10-05T00:00:00.000 | I153: 4
A154: 153 | B154: =R[-20]C+1 -> 8 | C154: 4 | D154: =R[-20]C+3 -> 23 | E154: • Phân NPK: | F154: 11.5 kg | H154: 2022-10-05T00:00:00.000 | I154: 5
A155: 154 | B155: =R[-20]C+1 -> 8 | C155: 4 | D155: =R[-20]C+3 -> 23 | E155: • Phân Khác: | H155: 2022-10-05T00:00:00.000 | I155: 6
A156: 155 | B156: =R[-20]C+1 -> 8 | C156: 4 | D156: =R[-20]C+3 -> 24 | E156: • Phân hữu cơ: | H156: 2022-10-28T00:00:00.000 | I156: 1
A157: 156 | B157: =R[-20]C+1 -> 8 | C157: 4 | D157: =R[-20]C+3 -> 24 | E157: • Phân cải tạo đất | H157: 2022-10-28T00:00:00.000 | I157: 2
A158: 157 | B158: =R[-20]C+1 -> 8 | C158: 4 | D158: =R[-20]C+3 -> 24 | E158: • Ure: | H158: 2022-10-28T00:00:00.000 | I158: 3
A159: 158 | B159: =R[-20]C+1 -> 8 | C159: 4 | D159: =R[-20]C+3 -> 24 | E159: • Phân DAP: | H159: 2022-10-28T00:00:00.000 | I159: 4
A160: 159 | B160: =R[-20]C+1 -> 8 | C160: 4 | D160: =R[-20]C+3 -> 24 | E160: • Phân NPK: | F160: 11.5 kg | H160: 2022-10-28T00:00:00.000 | I160: 5
A161: 160 | B161: =R[-20]C+1 -> 8 | C161: 4 | D161: =R[-20]C+3 -> 24 | E161: • Phân Khác: | H161: 2022-10-28T00:00:00.000 | I161: 6
A162: 161 | B162: =R[-20]C+1 -> 9 | C162: 4 | D162: =R[-20]C+3 -> 25 | E162: • Phân hữu cơ: | H162: 2022-09-25T00:00:00.000 | I162: 1
A163: 162 | B163: =R[-20]C+1 -> 9 | C163: 4 | D163: =R[-20]C+3 -> 25 | E163: • Phân cải tạo đất | H163: 2022-09-25T00:00:00.000 | I163: 2
A164: 163 | B164: =R[-20]C+1 -> 9 | C164: 4 | D164: =R[-20]C+3 -> 25 | E164: • Ure: | F164: 3.8 kg | H164: 2022-09-25T00:00:00.000 | I164: 3
A165: 164 | B165: =R[-20]C+1 -> 9 | C165: 4 | D165: =R[-20]C+3 -> 25 | E165: • Phân Lân: | H165: 2022-09-25T00:00:00.000 | I165: 4
A166: 165 | B166: =R[-20]C+1 -> 9 | C166: 4 | D166: =R[-20]C+3 -> 25 | E166: • Phân Kali: | H166: 2022-09-25T00:00:00.000 | I166: 5
A167: 166 | B167: =R[-20]C+1 -> 9 | C167: 4 | D167: =R[-20]C+3 -> 25 | E167: • Phân DAP: | F167: 2.5 kg | H167: 2022-09-25T00:00:00.000 | I167: 6
A168: 167 | B168: =R[-20]C+1 -> 9 | C168: 4 | D168: =R[-20]C+3 -> 25 | E168: • Phân NPK: | H168: 2022-09-25T00:00:00.000 | I168: 7
A169: 168 | B169: =R[-20]C+1 -> 9 | C169: 4 | D169: =R[-20]C+3 -> 25 | E169: • Phân Khác: | H169: 2022-09-25T00:00:00.000 | I169: 8
A170: 169 | B170: =R[-20]C+1 -> 9 | C170: 4 | D170: =R[-20]C+3 -> 26 | E170: • Phân hữu cơ: | H170: 2022-10-05T00:00:00.000 | I170: 1
A171: 170 | B171: =R[-20]C+1 -> 9 | C171: 4 | D171: =R[-20]C+3 -> 26 | E171: • Phân cải tạo đất | H171: 2022-10-05T00:00:00.000 | I171: 2
A172: 171 | B172: =R[-20]C+1 -> 9 | C172: 4 | D172: =R[-20]C+3 -> 26 | E172: • Ure: | H172: 2022-10-05T00:00:00.000 | I172: 3
A173: 172 | B173: =R[-20]C+1 -> 9 | C173: 4 | D173: =R[-20]C+3 -> 26 | E173: • Phân DAP: | H173: 2022-10-05T00:00:00.000 | I173: 4
A174: 173 | B174: =R[-20]C+1 -> 9 | C174: 4 | D174: =R[-20]C+3 -> 26 | E174: • Phân NPK: | F174: 11.5 kg | H174: 2022-10-05T00:00:00.000 | I174: 5
A175: 174 | B175: =R[-20]C+1 -> 9 | C175: 4 | D175: =R[-20]C+3 -> 26 | E175: • Phân Khác: | H175: 2022-10-05T00:00:00.000 | I175: 6
A176: 175 | B176: =R[-20]C+1 -> 9 | C176: 4 | D176: =R[-20]C+3 -> 27 | E176: • Phân hữu cơ: | H176: 2022-10-28T00:00:00.000 | I176: 1
A177: 176 | B177: =R[-20]C+1 -> 9 | C177: 4 | D177: =R[-20]C+3 -> 27 | E177: • Phân cải tạo đất | H177: 2022-10-28T00:00:00.000 | I177: 2
A178: 177 | B178: =R[-20]C+1 -> 9 | C178: 4 | D178: =R[-20]C+3 -> 27 | E178: • Ure: | H178: 2022-10-28T00:00:00.000 | I178: 3
A179: 178 | B179: =R[-20]C+1 -> 9 | C179: 4 | D179: =R[-20]C+3 -> 27 | E179: • Phân DAP: | H179: 2022-10-28T00:00:00.000 | I179: 4
A180: 179 | B180: =R[-20]C+1 -> 9 | C180: 4 | D180: =R[-20]C+3 -> 27 | E180: • Phân NPK: | F180: 11.5 kg | H180: 2022-10-28T00:00:00.000 | I180: 5
A181: 180 | B181: =R[-20]C+1 -> 9 | C181: 4 | D181: =R[-20]C+3 -> 27 | E181: • Phân Khác: | H181: 2022-10-28T00:00:00.000 | I181: 6
A182: 181 | B182: =R[-20]C+1 -> 10 | C182: 4 | D182: =R[-20]C+3 -> 28 | E182: • Phân hữu cơ: | H182: 2022-09-25T00:00:00.000 | I182: 1
A183: 182 | B183: =R[-20]C+1 -> 10 | C183: 4 | D183: =R[-20]C+3 -> 28 | E183: • Phân cải tạo đất | H183: 2022-09-25T00:00:00.000 | I183: 2
A184: 183 | B184: =R[-20]C+1 -> 10 | C184: 4 | D184: =R[-20]C+3 -> 28 | E184: • Ure: | F184: 3.8 kg | H184: 2022-09-25T00:00:00.000 | I184: 3
A185: 184 | B185: =R[-20]C+1 -> 10 | C185: 4 | D185: =R[-20]C+3 -> 28 | E185: • Phân Lân: | H185: 2022-09-25T00:00:00.000 | I185: 4
A186: 185 | B186: =R[-20]C+1 -> 10 | C186: 4 | D186: =R[-20]C+3 -> 28 | E186: • Phân Kali: | H186: 2022-09-25T00:00:00.000 | I186: 5
A187: 186 | B187: =R[-20]C+1 -> 10 | C187: 4 | D187: =R[-20]C+3 -> 28 | E187: • Phân DAP: | F187: 2.5 kg | H187: 2022-09-25T00:00:00.000 | I187: 6
A188: 187 | B188: =R[-20]C+1 -> 10 | C188: 4 | D188: =R[-20]C+3 -> 28 | E188: • Phân NPK: | H188: 2022-09-25T00:00:00.000 | I188: 7
A189: 188 | B189: =R[-20]C+1 -> 10 | C189: 4 | D189: =R[-20]C+3 -> 28 | E189: • Phân Khác: | H189: 2022-09-25T00:00:00.000 | I189: 8
A190: 189 | B190: =R[-20]C+1 -> 10 | C190: 4 | D190: =R[-20]C+3 -> 29 | E190: • Phân hữu cơ: | H190: 2022-10-05T00:00:00.000 | I190: 1
A191: 190 | B191: =R[-20]C+1 -> 10 | C191: 4 | D191: =R[-20]C+3 -> 29 | E191: • Phân cải tạo đất | H191: 2022-10-05T00:00:00.000 | I191: 2
A192: 191 | B192: =R[-20]C+1 -> 10 | C192: 4 | D192: =R[-20]C+3 -> 29 | E192: • Ure: | H192: 2022-10-05T00:00:00.000 | I192: 3
A193: 192 | B193: =R[-20]C+1 -> 10 | C193: 4 | D193: =R[-20]C+3 -> 29 | E193: • Phân DAP: | H193: 2022-10-05T00:00:00.000 | I193: 4
A194: 193 | B194: =R[-20]C+1 -> 10 | C194: 4 | D194: =R[-20]C+3 -> 29 | E194: • Phân NPK: | F194: 11.5 kg | H194: 2022-10-05T00:00:00.000 | I194: 5
A195: 194 | B195: =R[-20]C+1 -> 10 | C195: 4 | D195: =R[-20]C+3 -> 29 | E195: • Phân Khác: | H195: 2022-10-05T00:00:00.000 | I195: 6
A196: 195 | B196: =R[-20]C+1 -> 10 | C196: 4 | D196: =R[-20]C+3 -> 30 | E196: • Phân hữu cơ: | H196: 2022-10-28T00:00:00.000 | I196: 1
A197: 196 | B197: =R[-20]C+1 -> 10 | C197: 4 | D197: =R[-20]C+3 -> 30 | E197: • Phân cải tạo đất | H197: 2022-10-28T00:00:00.000 | I197: 2
A198: 197 | B198: =R[-20]C+1 -> 10 | C198: 4 | D198: =R[-20]C+3 -> 30 | E198: • Ure: | H198: 2022-10-28T00:00:00.000 | I198: 3
A199: 198 | B199: =R[-20]C+1 -> 10 | C199: 4 | D199: =R[-20]C+3 -> 30 | E199: • Phân DAP: | H199: 2022-10-28T00:00:00.000 | I199: 4
A200: 199 | B200: =R[-20]C+1 -> 10 | C200: 4 | D200: =R[-20]C+3 -> 30 | E200: • Phân NPK: | F200: 11.5 kg | H200: 2022-10-28T00:00:00.000 | I200: 5
A201: 200 | B201: =R[-20]C+1 -> 10 | C201: 4 | D201: =R[-20]C+3 -> 30 | E201: • Phân Khác: | H201: 2022-10-28T00:00:00.000 | I201: 6
A202: 201 | B202: =R[-20]C+1 -> 11 | C202: 4 | D202: =R[-20]C+3 -> 31 | E202: • Phân hữu cơ: | H202: 2022-09-25T00:00:00.000 | I202: 1
A203: 202 | B203: =R[-20]C+1 -> 11 | C203: 4 | D203: =R[-20]C+3 -> 31 | E203: • Phân cải tạo đất | H203: 2022-09-25T00:00:00.000 | I203: 2
A204: 203 | B204: =R[-20]C+1 -> 11 | C204: 4 | D204: =R[-20]C+3 -> 31 | E204: • Ure: | F204: 3.8 kg | H204: 2022-09-25T00:00:00.000 | I204: 3
A205: 204 | B205: =R[-20]C+1 -> 11 | C205: 4 | D205: =R[-20]C+3 -> 31 | E205: • Phân Lân: | H205: 2022-09-25T00:00:00.000 | I205: 4
A206: 205 | B206: =R[-20]C+1 -> 11 | C206: 4 | D206: =R[-20]C+3 -> 31 | E206: • Phân Kali: | H206: 2022-09-25T00:00:00.000 | I206: 5
A207: 206 | B207: =R[-20]C+1 -> 11 | C207: 4 | D207: =R[-20]C+3 -> 31 | E207: • Phân DAP: | F207: 2.5 kg | H207: 2022-09-25T00:00:00.000 | I207: 6
A208: 207 | B208: =R[-20]C+1 -> 11 | C208: 4 | D208: =R[-20]C+3 -> 31 | E208: • Phân NPK: | H208: 2022-09-25T00:00:00.000 | I208: 7
A209: 208 | B209: =R[-20]C+1 -> 11 | C209: 4 | D209: =R[-20]C+3 -> 31 | E209: • Phân Khác: | H209: 2022-09-25T00:00:00.000 | I209: 8
A210: 209 | B210: =R[-20]C+1 -> 11 | C210: 4 | D210: =R[-20]C+3 -> 32 | E210: • Phân hữu cơ: | H210: 2022-10-05T00:00:00.000 | I210: 1
A211: 210 | B211: =R[-20]C+1 -> 11 | C211: 4 | D211: =R[-20]C+3 -> 32 | E211: • Phân cải tạo đất | H211: 2022-10-05T00:00:00.000 | I211: 2
A212: 211 | B212: =R[-20]C+1 -> 11 | C212: 4 | D212: =R[-20]C+3 -> 32 | E212: • Ure: | H212: 2022-10-05T00:00:00.000 | I212: 3
A213: 212 | B213: =R[-20]C+1 -> 11 | C213: 4 | D213: =R[-20]C+3 -> 32 | E213: • Phân DAP: | H213: 2022-10-05T00:00:00.000 | I213: 4
A214: 213 | B214: =R[-20]C+1 -> 11 | C214: 4 | D214: =R[-20]C+3 -> 32 | E214: • Phân NPK: | F214: 11.5 kg | H214: 2022-10-05T00:00:00.000 | I214: 5
A215: 214 | B215: =R[-20]C+1 -> 11 | C215: 4 | D215: =R[-20]C+3 -> 32 | E215: • Phân Khác: | H215: 2022-10-05T00:00:00.000 | I215: 6
A216: 215 | B216: =R[-20]C+1 -> 11 | C216: 4 | D216: =R[-20]C+3 -> 33 | E216: • Phân hữu cơ: | H216: 2022-10-28T00:00:00.000 | I216: 1
A217: 216 | B217: =R[-20]C+1 -> 11 | C217: 4 | D217: =R[-20]C+3 -> 33 | E217: • Phân cải tạo đất | H217: 2022-10-28T00:00:00.000 | I217: 2
A218: 217 | B218: =R[-20]C+1 -> 11 | C218: 4 | D218: =R[-20]C+3 -> 33 | E218: • Ure: | H218: 2022-10-28T00:00:00.000 | I218: 3
A219: 218 | B219: =R[-20]C+1 -> 11 | C219: 4 | D219: =R[-20]C+3 -> 33 | E219: • Phân DAP: | H219: 2022-10-28T00:00:00.000 | I219: 4
A220: 219 | B220: =R[-20]C+1 -> 11 | C220: 4 | D220: =R[-20]C+3 -> 33 | E220: • Phân NPK: | F220: 11.5 kg | H220: 2022-10-28T00:00:00.000 | I220: 5
A221: 220 | B221: =R[-20]C+1 -> 11 | C221: 4 | D221: =R[-20]C+3 -> 33 | E221: • Phân Khác: | H221: 2022-10-28T00:00:00.000 | I221: 6