Sheet: Sheet1
A1: ID | B1: IDVUNGTRONG | C1: IDNHATKY | D1: TENTHUOC | E1: GIATRI | F1: SOLUONG | G1: CACHSUDUNG | H1: NGAYTHUCHIEN | I1: GHICHU
A2: 1 | B2: 1 | C2: 5 | D2: + Thuốc trừ ốc: | G2: 200 lit/lần/ha. | H2: 2022-09-17T00:00:00.000
A3: 2 | B3: 1 | C3: 5 | D3: + Thuốc trừ cỏ: | G3: 200 lit/lần/ha. | H3: 2022-09-21T00:00:00.000
A4: 3 | B4: 1 | C4: 5 | D4: + Thuốc trừ bệnh: | G4: 200 lit/lần/ha. | H4: 2022-11-02T00:00:00.000
A5: 4 | B5: 1 | C5: 5 | D5: + Thuốc trừ bệnh: | G5: 200 lit/lần/ha. | H5: 2022-11-22T00:00:00.000
A6: 5 | B6: 1 | C6: 5 | D6: + Thuốc trừ bệnh: | G6: 200 lit/lần/ha. | H6: 2022-12-07T00:00:00.000
A7: 6 | B7: 1 | C7: 5 | D7: + Phối hợp thuốc (trừ sâu - bệnh): | G7: 200 lit/lần/ha. | H7: 2022-11-02T00:00:00.000
A8: 8 | B8: 1 | C8: 5 | D8: + Phối hợp thuốc (trừ rầy - bệnh): | G8: 200 lit/lần/ha. | H8: 2022-11-22T00:00:00.000
A9: 10 | B9: 1 | C9: 5 | D9: + Phun theo thời điểm:
B10: =R[-8]C+1 -> 2 | C10: 5 | D10: + Thuốc trừ ốc: | G10: 200 lit/lần/ha. | H10: 2022-09-17T00:00:00.000
B11: =R[-8]C+1 -> 2 | C11: 5 | D11: + Thuốc trừ cỏ: | G11: 200 lit/lần/ha. | H11: 2022-09-21T00:00:00.000
B12: =R[-8]C+1 -> 2 | C12: 5 | D12: + Thuốc trừ bệnh: | G12: 200 lit/lần/ha. | H12: 2022-11-02T00:00:00.000
B13: =R[-8]C+1 -> 2 | C13: 5 | D13: + Thuốc trừ bệnh: | G13: 200 lit/lần/ha. | H13: 2022-11-22T00:00:00.000
B14: =R[-8]C+1 -> 2 | C14: 5 | D14: + Thuốc trừ bệnh: | G14: 200 lit/lần/ha. | H14: 2022-12-07T00:00:00.000
B15: =R[-8]C+1 -> 2 | C15: 5 | D15: + Phối hợp thuốc (trừ sâu - bệnh): | G15: 200 lit/lần/ha. | H15: 2022-11-02T00:00:00.000
B16: =R[-8]C+1 -> 2 | C16: 5 | D16: + Phối hợp thuốc (trừ rầy - bệnh): | G16: 200 lit/lần/ha. | H16: 2022-11-22T00:00:00.000
B17: =R[-8]C+1 -> 2 | C17: 5 | D17: + Phun theo thời điểm:
B18: =R[-8]C+1 -> 3 | C18: 5 | D18: + Thuốc trừ ốc: | G18: 200 lit/lần/ha. | H18: 2022-09-17T00:00:00.000
B19: =R[-8]C+1 -> 3 | C19: 5 | D19: + Thuốc trừ cỏ: | G19: 200 lit/lần/ha. | H19: 2022-09-21T00:00:00.000
B20: =R[-8]C+1 -> 3 | C20: 5 | D20: + Thuốc trừ bệnh: | G20: 200 lit/lần/ha. | H20: 2022-11-02T00:00:00.000
B21: =R[-8]C+1 -> 3 | C21: 5 | D21: + Thuốc trừ bệnh: | G21: 200 lit/lần/ha. | H21: 2022-11-22T00:00:00.000
B22: =R[-8]C+1 -> 3 | C22: 5 | D22: + Thuốc trừ bệnh: | G22: 200 lit/lần/ha. | H22: 2022-12-07T00:00:00.000
B23: =R[-8]C+1 -> 3 | C23: 5 | D23: + Phối hợp thuốc (trừ sâu - bệnh): | G23: 200 lit/lần/ha. | H23: 2022-11-02T00:00:00.000
B24: =R[-8]C+1 -> 3 | C24: 5 | D24: + Phối hợp thuốc (trừ rầy - bệnh): | G24: 200 lit/lần/ha. | H24: 2022-11-22T00:00:00.000
B25: =R[-8]C+1 -> 3 | C25: 5 | D25: + Phun theo thời điểm:
B26: =R[-8]C+1 -> 4 | C26: 5 | D26: + Thuốc trừ ốc: | G26: 200 lit/lần/ha. | H26: 2022-09-17T00:00:00.000
B27: =R[-8]C+1 -> 4 | C27: 5 | D27: + Thuốc trừ cỏ: | G27: 200 lit/lần/ha. | H27: 2022-09-21T00:00:00.000
B28: =R[-8]C+1 -> 4 | C28: 5 | D28: + Thuốc trừ bệnh: | G28: 200 lit/lần/ha. | H28: 2022-11-02T00:00:00.000
B29: =R[-8]C+1 -> 4 | C29: 5 | D29: + Thuốc trừ bệnh: | G29: 200 lit/lần/ha. | H29: 2022-11-22T00:00:00.000
B30: =R[-8]C+1 -> 4 | C30: 5 | D30: + Thuốc trừ bệnh: | G30: 200 lit/lần/ha. | H30: 2022-12-07T00:00:00.000
B31: =R[-8]C+1 -> 4 | C31: 5 | D31: + Phối hợp thuốc (trừ sâu - bệnh): | G31: 200 lit/lần/ha. | H31: 2022-11-02T00:00:00.000
B32: =R[-8]C+1 -> 4 | C32: 5 | D32: + Phối hợp thuốc (trừ rầy - bệnh): | G32: 200 lit/lần/ha. | H32: 2022-11-22T00:00:00.000
B33: =R[-8]C+1 -> 4 | C33: 5 | D33: + Phun theo thời điểm:
B34: =R[-8]C+1 -> 5 | C34: 5 | D34: + Thuốc trừ ốc: | G34: 200 lit/lần/ha. | H34: 2022-09-17T00:00:00.000
B35: =R[-8]C+1 -> 5 | C35: 5 | D35: + Thuốc trừ cỏ: | G35: 200 lit/lần/ha. | H35: 2022-09-21T00:00:00.000
B36: =R[-8]C+1 -> 5 | C36: 5 | D36: + Thuốc trừ bệnh: | G36: 200 lit/lần/ha. | H36: 2022-11-02T00:00:00.000
B37: =R[-8]C+1 -> 5 | C37: 5 | D37: + Thuốc trừ bệnh: | G37: 200 lit/lần/ha. | H37: 2022-11-22T00:00:00.000
B38: =R[-8]C+1 -> 5 | C38: 5 | D38: + Thuốc trừ bệnh: | G38: 200 lit/lần/ha. | H38: 2022-12-07T00:00:00.000
B39: =R[-8]C+1 -> 5 | C39: 5 | D39: + Phối hợp thuốc (trừ sâu - bệnh): | G39: 200 lit/lần/ha. | H39: 2022-11-02T00:00:00.000
B40: =R[-8]C+1 -> 5 | C40: 5 | D40: + Phối hợp thuốc (trừ rầy - bệnh): | G40: 200 lit/lần/ha. | H40: 2022-11-22T00:00:00.000
B41: =R[-8]C+1 -> 5 | C41: 5 | D41: + Phun theo thời điểm:
B42: =R[-8]C+1 -> 6 | C42: 5 | D42: + Thuốc trừ ốc: | G42: 200 lit/lần/ha. | H42: 2022-09-17T00:00:00.000
B43: =R[-8]C+1 -> 6 | C43: 5 | D43: + Thuốc trừ cỏ: | G43: 200 lit/lần/ha. | H43: 2022-09-21T00:00:00.000
B44: =R[-8]C+1 -> 6 | C44: 5 | D44: + Thuốc trừ bệnh: | G44: 200 lit/lần/ha. | H44: 2022-11-02T00:00:00.000
B45: =R[-8]C+1 -> 6 | C45: 5 | D45: + Thuốc trừ bệnh: | G45: 200 lit/lần/ha. | H45: 2022-11-22T00:00:00.000
B46: =R[-8]C+1 -> 6 | C46: 5 | D46: + Thuốc trừ bệnh: | G46: 200 lit/lần/ha. | H46: 2022-12-07T00:00:00.000
B47: =R[-8]C+1 -> 6 | C47: 5 | D47: + Phối hợp thuốc (trừ sâu - bệnh): | G47: 200 lit/lần/ha. | H47: 2022-11-02T00:00:00.000
B48: =R[-8]C+1 -> 6 | C48: 5 | D48: + Phối hợp thuốc (trừ rầy - bệnh): | G48: 200 lit/lần/ha. | H48: 2022-11-22T00:00:00.000
B49: =R[-8]C+1 -> 6 | C49: 5 | D49: + Phun theo thời điểm:
B50: =R[-8]C+1 -> 7 | C50: 5 | D50: + Thuốc trừ ốc: | G50: 200 lit/lần/ha. | H50: 2022-09-17T00:00:00.000
B51: =R[-8]C+1 -> 7 | C51: 5 | D51: + Thuốc trừ cỏ: | G51: 200 lit/lần/ha. | H51: 2022-09-21T00:00:00.000
B52: =R[-8]C+1 -> 7 | C52: 5 | D52: + Thuốc trừ bệnh: | G52: 200 lit/lần/ha. | H52: 2022-11-02T00:00:00.000
B53: =R[-8]C+1 -> 7 | C53: 5 | D53: + Thuốc trừ bệnh: | G53: 200 lit/lần/ha. | H53: 2022-11-22T00:00:00.000
B54: =R[-8]C+1 -> 7 | C54: 5 | D54: + Thuốc trừ bệnh: | G54: 200 lit/lần/ha. | H54: 2022-12-07T00:00:00.000
B55: =R[-8]C+1 -> 7 | C55: 5 | D55: + Phối hợp thuốc (trừ sâu - bệnh): | G55: 200 lit/lần/ha. | H55: 2022-11-02T00:00:00.000
B56: =R[-8]C+1 -> 7 | C56: 5 | D56: + Phối hợp thuốc (trừ rầy - bệnh): | G56: 200 lit/lần/ha. | H56: 2022-11-22T00:00:00.000
B57: =R[-8]C+1 -> 7 | C57: 5 | D57: + Phun theo thời điểm:
B58: =R[-8]C+1 -> 8 | C58: 5 | D58: + Thuốc trừ ốc: | G58: 200 lit/lần/ha. | H58: 2022-09-17T00:00:00.000
B59: =R[-8]C+1 -> 8 | C59: 5 | D59: + Thuốc trừ cỏ: | G59: 200 lit/lần/ha. | H59: 2022-09-21T00:00:00.000
B60: =R[-8]C+1 -> 8 | C60: 5 | D60: + Thuốc trừ bệnh: | G60: 200 lit/lần/ha. | H60: 2022-11-02T00:00:00.000
B61: =R[-8]C+1 -> 8 | C61: 5 | D61: + Thuốc trừ bệnh: | G61: 200 lit/lần/ha. | H61: 2022-11-22T00:00:00.000
B62: =R[-8]C+1 -> 8 | C62: 5 | D62: + Thuốc trừ bệnh: | G62: 200 lit/lần/ha. | H62: 2022-12-07T00:00:00.000
B63: =R[-8]C+1 -> 8 | C63: 5 | D63: + Phối hợp thuốc (trừ sâu - bệnh): | G63: 200 lit/lần/ha. | H63: 2022-11-02T00:00:00.000
B64: =R[-8]C+1 -> 8 | C64: 5 | D64: + Phối hợp thuốc (trừ rầy - bệnh): | G64: 200 lit/lần/ha. | H64: 2022-11-22T00:00:00.000
B65: =R[-8]C+1 -> 8 | C65: 5 | D65: + Phun theo thời điểm:
B66: =R[-8]C+1 -> 9 | C66: 5 | D66: + Thuốc trừ ốc: | G66: 200 lit/lần/ha. | H66: 2022-09-17T00:00:00.000
B67: =R[-8]C+1 -> 9 | C67: 5 | D67: + Thuốc trừ cỏ: | G67: 200 lit/lần/ha. | H67: 2022-09-21T00:00:00.000
B68: =R[-8]C+1 -> 9 | C68: 5 | D68: + Thuốc trừ bệnh: | G68: 200 lit/lần/ha. | H68: 2022-11-02T00:00:00.000
B69: =R[-8]C+1 -> 9 | C69: 5 | D69: + Thuốc trừ bệnh: | G69: 200 lit/lần/ha. | H69: 2022-11-22T00:00:00.000
B70: =R[-8]C+1 -> 9 | C70: 5 | D70: + Thuốc trừ bệnh: | G70: 200 lit/lần/ha. | H70: 2022-12-07T00:00:00.000
B71: =R[-8]C+1 -> 9 | C71: 5 | D71: + Phối hợp thuốc (trừ sâu - bệnh): | G71: 200 lit/lần/ha. | H71: 2022-11-02T00:00:00.000
B72: =R[-8]C+1 -> 9 | C72: 5 | D72: + Phối hợp thuốc (trừ rầy - bệnh): | G72: 200 lit/lần/ha. | H72: 2022-11-22T00:00:00.000
B73: =R[-8]C+1 -> 9 | C73: 5 | D73: + Phun theo thời điểm:
B74: =R[-8]C+1 -> 10 | C74: 5 | D74: + Thuốc trừ ốc: | G74: 200 lit/lần/ha. | H74: 2022-09-17T00:00:00.000
B75: =R[-8]C+1 -> 10 | C75: 5 | D75: + Thuốc trừ cỏ: | G75: 200 lit/lần/ha. | H75: 2022-09-21T00:00:00.000
B76: =R[-8]C+1 -> 10 | C76: 5 | D76: + Thuốc trừ bệnh: | G76: 200 lit/lần/ha. | H76: 2022-11-02T00:00:00.000
B77: =R[-8]C+1 -> 10 | C77: 5 | D77: + Thuốc trừ bệnh: | G77: 200 lit/lần/ha. | H77: 2022-11-22T00:00:00.000
B78: =R[-8]C+1 -> 10 | C78: 5 | D78: + Thuốc trừ bệnh: | G78: 200 lit/lần/ha. | H78: 2022-12-07T00:00:00.000
B79: =R[-8]C+1 -> 10 | C79: 5 | D79: + Phối hợp thuốc (trừ sâu - bệnh): | G79: 200 lit/lần/ha. | H79: 2022-11-02T00:00:00.000
B80: =R[-8]C+1 -> 10 | C80: 5 | D80: + Phối hợp thuốc (trừ rầy - bệnh): | G80: 200 lit/lần/ha. | H80: 2022-11-22T00:00:00.000
B81: =R[-8]C+1 -> 10 | C81: 5 | D81: + Phun theo thời điểm:
B82: =R[-8]C+1 -> 11 | C82: 5 | D82: + Thuốc trừ ốc: | G82: 200 lit/lần/ha. | H82: 2022-09-17T00:00:00.000
B83: =R[-8]C+1 -> 11 | C83: 5 | D83: + Thuốc trừ cỏ: | G83: 200 lit/lần/ha. | H83: 2022-09-21T00:00:00.000
B84: =R[-8]C+1 -> 11 | C84: 5 | D84: + Thuốc trừ bệnh: | G84: 200 lit/lần/ha. | H84: 2022-11-02T00:00:00.000
B85: =R[-8]C+1 -> 11 | C85: 5 | D85: + Thuốc trừ bệnh: | G85: 200 lit/lần/ha. | H85: 2022-11-22T00:00:00.000
B86: =R[-8]C+1 -> 11 | C86: 5 | D86: + Thuốc trừ bệnh: | G86: 200 lit/lần/ha. | H86: 2022-12-07T00:00:00.000
B87: =R[-8]C+1 -> 11 | C87: 5 | D87: + Phối hợp thuốc (trừ sâu - bệnh): | G87: 200 lit/lần/ha. | H87: 2022-11-02T00:00:00.000
B88: =R[-8]C+1 -> 11 | C88: 5 | D88: + Phối hợp thuốc (trừ rầy - bệnh): | G88: 200 lit/lần/ha. | H88: 2022-11-22T00:00:00.000
B89: =R[-8]C+1 -> 11 | C89: 5 | D89: + Phun theo thời điểm: