Sheet: Sheet1
A1: ID | B1: IDVUNGTRONG | C1: IDNHATKY | D1: SUDUNGPHANBON | E1: NGAYTHUCHIEN | F1: SAPXEP | G1: GHICHU
A2: 1 | B2: 1 | C2: 4 | D2: Loại phân: | E2: 2022-09-25T00:00:00.000 | F2: 1
A3: 2 | B3: 1 | C3: 4 | D3: Loại phân: | E3: 2022-10-05T00:00:00.000 | F3: 2
A4: 3 | B4: 1 | C4: 4 | D4: Loại phân: | E4: 2022-10-28T00:00:00.000 | F4: 3
A5: 4 | B5: 2 | C5: 4 | D5: Loại phân: | E5: 2022-09-25T00:00:00.000 | F5: 1
A6: 5 | B6: 2 | C6: 4 | D6: Loại phân: | E6: 2022-10-05T00:00:00.000 | F6: 2
A7: 6 | B7: 2 | C7: 4 | D7: Loại phân: | E7: 2022-10-28T00:00:00.000 | F7: 3
A8: 7 | B8: =R[-3]C+1 -> 3 | C8: 4 | D8: Loại phân: | E8: 2022-09-25T00:00:00.000 | F8: 1
A9: 8 | B9: =R[-3]C+1 -> 3 | C9: 4 | D9: Loại phân: | E9: 2022-10-05T00:00:00.000 | F9: 2
A10: 9 | B10: =R[-3]C+1 -> 3 | C10: 4 | D10: Loại phân: | E10: 2022-10-28T00:00:00.000 | F10: 3
A11: 10 | B11: =R[-3]C+1 -> 4 | C11: 4 | D11: Loại phân: | E11: 2022-09-25T00:00:00.000 | F11: 1
A12: 11 | B12: =R[-3]C+1 -> 4 | C12: 4 | D12: Loại phân: | E12: 2022-10-05T00:00:00.000 | F12: 2
A13: 12 | B13: =R[-3]C+1 -> 4 | C13: 4 | D13: Loại phân: | E13: 2022-10-28T00:00:00.000 | F13: 3
A14: 13 | B14: =R[-3]C+1 -> 5 | C14: 4 | D14: Loại phân: | E14: 2022-09-25T00:00:00.000 | F14: 1
A15: 14 | B15: =R[-3]C+1 -> 5 | C15: 4 | D15: Loại phân: | E15: 2022-10-05T00:00:00.000 | F15: 2
A16: 15 | B16: =R[-3]C+1 -> 5 | C16: 4 | D16: Loại phân: | E16: 2022-10-28T00:00:00.000 | F16: 3
A17: 16 | B17: =R[-3]C+1 -> 6 | C17: 4 | D17: Loại phân: | E17: 2022-09-25T00:00:00.000 | F17: 1
A18: 17 | B18: =R[-3]C+1 -> 6 | C18: 4 | D18: Loại phân: | E18: 2022-10-05T00:00:00.000 | F18: 2
A19: 18 | B19: =R[-3]C+1 -> 6 | C19: 4 | D19: Loại phân: | E19: 2022-10-28T00:00:00.000 | F19: 3
A20: 19 | B20: =R[-3]C+1 -> 7 | C20: 4 | D20: Loại phân: | E20: 2022-09-25T00:00:00.000 | F20: 1
A21: 20 | B21: =R[-3]C+1 -> 7 | C21: 4 | D21: Loại phân: | E21: 2022-10-05T00:00:00.000 | F21: 2
A22: 21 | B22: =R[-3]C+1 -> 7 | C22: 4 | D22: Loại phân: | E22: 2022-10-28T00:00:00.000 | F22: 3
A23: 22 | B23: =R[-3]C+1 -> 8 | C23: 4 | D23: Loại phân: | E23: 2022-09-25T00:00:00.000 | F23: 1
A24: 23 | B24: =R[-3]C+1 -> 8 | C24: 4 | D24: Loại phân: | E24: 2022-10-05T00:00:00.000 | F24: 2
A25: 24 | B25: =R[-3]C+1 -> 8 | C25: 4 | D25: Loại phân: | E25: 2022-10-28T00:00:00.000 | F25: 3
A26: 25 | B26: =R[-3]C+1 -> 9 | C26: 4 | D26: Loại phân: | E26: 2022-09-25T00:00:00.000 | F26: 1
A27: 26 | B27: =R[-3]C+1 -> 9 | C27: 4 | D27: Loại phân: | E27: 2022-10-05T00:00:00.000 | F27: 2
A28: 27 | B28: =R[-3]C+1 -> 9 | C28: 4 | D28: Loại phân: | E28: 2022-10-28T00:00:00.000 | F28: 3
A29: 28 | B29: =R[-3]C+1 -> 10 | C29: 4 | D29: Loại phân: | E29: 2022-09-25T00:00:00.000 | F29: 1
A30: 29 | B30: =R[-3]C+1 -> 10 | C30: 4 | D30: Loại phân: | E30: 2022-10-05T00:00:00.000 | F30: 2
A31: 30 | B31: =R[-3]C+1 -> 10 | C31: 4 | D31: Loại phân: | E31: 2022-10-28T00:00:00.000 | F31: 3
A32: 31 | B32: =R[-3]C+1 -> 11 | C32: 4 | D32: Loại phân: | E32: 2022-09-25T00:00:00.000 | F32: 1
A33: 32 | B33: =R[-3]C+1 -> 11 | C33: 4 | D33: Loại phân: | E33: 2022-10-05T00:00:00.000 | F33: 2
A34: 33 | B34: =R[-3]C+1 -> 11 | C34: 4 | D34: Loại phân: | E34: 2022-10-28T00:00:00.000 | F34: 3